Epizoda;Prizor;Lokacija;Okoliš?ine;Opis;Liki;Statisti;Igralci;Število strani scenarija
39;39-01;Lj/Julijino Stanovanje/Dnevna Soba;NO?-INT.;BB ZAGROZI JULIJI  NAJ SE UMAKNE IN NEHA S PE?NIKOM SPLETKARITI PROTI NJEMU  SICER JO BO UNI?IL.;10 Julija,19 Bb;;Sabina Kogovšek,Valter Dragan;2 1/4
39;39-02;Lj/Nadino Stanovanje/Dnevna Soba;NO?-INT.; ZMENEK LARE IN DR. MIRTA SE NADALJUJE DOMA  A NJUN PRVI STRASTEN TRENUTEK ZMOTI NADA.;2 Lara,13 Nada,257 Dr. Mirt;;Gaja Fila?,Aleksandra Balmazovi?,Žiga Udir;1 1/4
39;39-03;Lj/Nadino Stanovanje/Kuhinja;DAN-INT.; NADA JE VESELA  DA IMA LARA NOVEGA FANTA - LARA PA NI PREPRI?ANA  ?E JE PRIPRAVLJENA NA NOVO ZVEZO.;2 Lara,13 Nada;;Gaja Fila?,Aleksandra Balmazovi?;1 1/2
39;39-04;Lj/Julijino Stanovanje/Predsoba;DAN-INT.; ROMAN SE ŽELI ZARADI EDIJEVEGA ŠKANDALA V MEDIJIH DISTANCIRATI OD JULIJE.;10 Julija,251 Roman;;Sabina Kogovšek,Uroš Smolej;1 3/4
39;39-05;Kemp/Janina Parcela/Pred Avtodomom;DAN-EXT.;HRVOJE JE PRIŠEL PREVERIT  ?E JE Z JANO KAJ BOLJE.;14 Hrvoje,213 KEMP MANJ (3);KEMP MANJ (3);Alen Šalinovi?; 7/8
39;39-06;Kemp/Janina Parcela/Avtodom;DAN-INT./EXT.;JANA SE JE ZAPRLA VASE IN PRED SVETOM.;14 Hrvoje,12 Jana;;Alen Šalinovi?,Tanja Poto?nik; 1/2
39;39-07;Lj/Nadino Stanovanje/Dnevni Del;DAN-INT.; DR. MIRT PRESENETI LARO - PRIŠEL JO JE ISKAT  DA GRESTA SKUPAJ V SLUŽBO.;2 Lara,13 Nada,257 Dr. Mirt;;Gaja Fila?,Aleksandra Balmazovi?,Žiga Udir;2 3/8
39;39-08;Lj/Julijino Stanovanje/Kuhinja;DAN-INT.; JULIJINA POZICIJA ZNOTRAJ FARMAKISSA JE VSE PREJ KOT VARNA.;10 Julija,251 Roman;;Sabina Kogovšek,Uroš Smolej;2
39;39-09;Kemp/Recepcija;DAN-INT.; HRVOJE SVOJE SKRBI V ZVEZI Z JANO ZAUPA DINU  KI PA MU SVETUJE  NAJ NE SILI VANJO.;14 Hrvoje,4 Dino,353 Gost nemško govore?i,354 Gost italijansko govore?i;;Alen Šalinovi?,Matino Antunovi?;2 3/8
39;39-10;Lj/Steinerjeva Klinika/Sprejemnica;DAN-INT.; LARA IN DR. MIRT VSE BOLJ DELUJETA KOT PRAVI PAR - KAR MARK VSE TEŽJE SPREJEMA.;2 Lara,1 Mark,257 Dr. Mirt;;Gaja Fila?,Matej Zemlji?,Žiga Udir;2 1/4
39;39-11;Lj/Edvardovo Stanovanje/Dnevna Soba;DAN-INT.; EDI BI SE RAD POVSEM UMAKNIL IZ POLITI?NIH IGRIC  JULIJA PA JE SAMO ŠE BOLJ LA?NA BB-JEVE KRVI.;3 Edvard,10 Julija;;Aleš Vali?,Sabina Kogovšek;2 5/8
39;39-12;Lj/Steinerjeva Klinika/Pisarna/Ordinacija;DAN-INT.; LARA JE NAVDUŠENA NAD MIRTOVIM DOPRINOSOM K PROJEKTU  ZATO SE MARK KAR SAM POHVALI S SVOJIM.;2 Lara,1 Mark,257 Dr. Mirt;;Gaja Fila?,Matej Zemlji?,Žiga Udir;1 1/4
39;39-13;Kemp/Ex Renatova Parcela/Pred Prikolico;DAN-EXT.;PARALELNI SCENI (TELEFONSKI POGOVOR) SAŠKA IZVE  DA JE MERI PRIPRAVLJENA DATI FRENKU ŠE ENO PRILOŽNOST  AMPAK NE SAMO NA LEPE O?I.;5 Saška,6PS Meri PS,213 KEMP MANJ (3);KEMP MANJ (3);Mila Peršin,Vesna Pernar?i?;2 3/8
39;39-14;Lj/Kozmeti?ni Salon;DAN-INT.;PARALELNI SCENI (TELEFONSKI POGOVOR) SAŠKA IZVE  DA JE MERI PRIPRAVLJENA DATI FRENKU ŠE ENO PRILOŽNOST  AMPAK NE SAMO NA LEPE O?I.;6 Meri,5PS Saška PS;;Vesna Pernar?i?,Mila Peršin;2 5/8
39;39-15;Lj/Edvardovo Stanovanje/Dnevna Soba;DAN-INT.; EDVARD PREDA VODENJE KLINIKE STEINER JULIJI.;3 Edvard,10 Julija;;Aleš Vali?,Sabina Kogovšek;2 1/8
39;39-16;Lj/Steinerjeva Klinika/Pisarna/Ordinacija;DAN-INT.; ZA ZAGONSKA SREDSTVA DR. MIRT PREDLAGA PRIJAVO NA EVROPSKI RAZPIS  A MARK VERJAME  DA LAHKO SAM PRISKRBI DENAR.;2 Lara,1 Mark,257 Dr. Mirt;;Gaja Fila?,Matej Zemlji?,Žiga Udir;2
39;39-17;Lj/Edvardovo Stanovanje/Dnevna Soba;DAN-INT.; MARK PROSI EDIJA ZA DENAR IZ PRORA?UNA KLINIKE. EDI GA PRUSMERI NA NOVO ŠEFICO - JULIJO.;1 Mark,3 Edvard;;Matej Zemlji?,Aleš Vali?;3
39;39-18;Kemp/Janina Parcela/Pred Avtodomom;DAN-EXT.;HRVOJE ZASKRBLJEN UGOTOVI  DA JE Z JANO VEDNO SLABŠE.;14 Hrvoje,12 Jana,213 KEMP MANJ (3);KEMP MANJ (3);Alen Šalinovi?,Tanja Poto?nik; 7/8
39;39-19;Lj/Julijino Stanovanje/Dnevna Soba;DAN-INT.; MARK PROSI JULIJO ZA DENAR ZA ZAGON DOBRODELNEGA PROJEKTA. JULIJA GA ZAVRNE.;1 Mark,10 Julija;;Matej Zemlji?,Sabina Kogovšek;3 1/8
39;39-20;Kemp/Pred recepcijo;DAN-EXT.; SAŠKA SVETUJE HRVOJU  DA JANI PRISKRBI STROKOVNO POMO?.;14 Hrvoje,5 Saška,206 KEMP STANDARD (7);KEMP STANDARD (7);Alen Šalinovi?,Mila Peršin;2
39;39-21;Lj/Kozmeti?ni Salon;DAN-INT.; MERI NA?RTUJE PRENOVO SALONA.;6 Meri,355 Oblikovalka;;Vesna Pernar?i?,Maja Furman;1 1/4
39;39-22;Lj/Steinerjeva Klinika/Pisarna/Ordinacija;DAN-INT.; MARK NIMA DRUGE IZBIRE  KOT DA UPOŠTEVA MIRTOV NASVET  IN SE LOTI PRIJAVE NA RAZPIS ZA EVROPSKA SREDSTVA.;2 Lara,1 Mark,257 Dr. Mirt;;Gaja Fila?,Matej Zemlji?,Žiga Udir;1 3/4
39;39-23;Lj/Pasaža/Lokal;DAN-INT.; NADA PRIDE V PASAŽO NA DOGOVORJENO KOSILO Z LARO IN DR. MIRTOM  KO PREJME HRVOJEV KLIC.;18 Nina,13 Nada,247 STATIST A1,248 STATIST A2,249 STATIST B1,250 STATIST B2;STATIST A1,STATIST A2,STATIST B1,STATIST B2;Melani Mekicar,Aleksandra Balmazovi?;1
39;39-24;Lj/Kozmeti?ni Salon;DAN-INT.; MERI LE DO?AKA FRENKA  KI JI PRINESE KUVERTO.;7 Frenk,6 Meri,355 Oblikovalka;;Gaber Trseglav,Vesna Pernar?i?,Maja Furman; 7/8
39;39-25;Lj/Pasaža/Lokal;DAN-INT.; NADA MORA V KEMP POSKRBET ZA JANO. ŽELI  DA GRE LARA Z NJO.;2 Lara,13 Nada,257 Dr. Mirt,249 STATIST B1,250 STATIST B2;STATIST B1,STATIST B2;Gaja Fila?,Aleksandra Balmazovi?,Žiga Udir; 7/8
39;39-26;Lj/Bb-Jeva Pisarna;DAN-INT.;BB IZVE ZA SANJINO NAMERO  DA BO ZAHTEVALA OBDUKCIJO POKOJNEGA O?ETA.;19 Bb,258OFF Sanja Off,15OFF Pe?nik Off,9 Renato;;Valter Dragan,Nina Rakovec,Matija Rupel,Primož Vrhovec;1 3/8
40;40-01;Lj/Pasaža/Lokal;DAN-INT.;NADA PROSI LARO  NAJ POZABI ZAMERO DO JANE  SAJ JU JANA POTREBUJE. LARA NO?E Z NADO V KEMP.;2 Lara,18 Nina,13 Nada,257 Dr. Mirt,249 STATIST B1,250 STATIST B2;STATIST B1,STATIST B2;Gaja Fila?,Melani Mekicar,Aleksandra Balmazovi?,Žiga Udir;1 3/4
40;40-02;Lj/Kozmeti?ni Salon;DAN-INT.;FRENK JE MERI NAMESTO ZAHTEVANEGA DENARJA PRINESEL LO?ITVENE PAPIRJE.;7 Frenk,6 Meri,355 Oblikovalka;;Gaber Trseglav,Vesna Pernar?i?,Maja Furman;1 3/4
40;40-03;Lj/Dolen?evo Stanovanje/Dnevna Soba;DAN-INT.;ERIKA JE JEZNA NA SANJO  KI NA?RTUJE O?ETOV IZKOP IN OBDUKCIJO  DA BI IZVEDELA RESNICO O NJEGOVI SMRTI.;252 Erika,258 Sanja;;Bernarda Oman,Nina Rakovec;2 1/8
40;40-04;Lj/Pasaža/Lokal;DAN-INT.;NINA POSKUŠA PREPRI?ATI LARO  NAJ NEHA TRMARIT IN NAJ SE POBOTA Z JANO. LARI NI DO NININIH PRIDIG.;2 Lara,18 Nina,257 Dr. Mirt,249 STATIST B1,250 STATIST B2;STATIST B1,STATIST B2;Gaja Fila?,Melani Mekicar,Žiga Udir;2 3/4
40;40-05;Lj/Kozmeti?ni Salon;DAN-INT.;FRENK IMA DOVOLJ MERIJINIH IGRIC  O?ITNO JE NJUNEGA ZAKONA KONEC. JEZNA MERI MU ZAGROZI  DA GA BO TO DRAGO STALO.;7 Frenk,6 Meri;;Gaber Trseglav,Vesna Pernar?i?;1 1/2
40;40-06;Lj/Dolen?evo Stanovanje/Dnevna Soba;DAN-INT.;ERIKA PROSI BB-JA  NAJ SPAMETUJE SANJO IN JO PREPRI?A  NAJ OPUSTI IDEJO O IZKOPU STANETA.;19 Bb,252 Erika,258 Sanja;;Valter Dragan,Bernarda Oman,Nina Rakovec;1 7/8
40;40-07;Lj/Pasaža/Lokal;DAN-INT.;DR. MIRTA ZANIMA  ZAKAJ JE LARA SPRTA Z JANO. NINA MU SVETUJE  NAJ NE DREZA V TO.;18 Nina,257 Dr. Mirt,249 STATIST B1,250 STATIST B2;STATIST B1,STATIST B2;Melani Mekicar,Žiga Udir;2 3/8
40;40-08;Lj/Steinerjeva Klinika/Sprejemnica;DAN-INT.;MARK PONUDI LA?NI LARI  DA JI PRINESE MALICO. MIO ZBODE VSE BOLJ PRIJATELJSKI ODNOS MED MARKOM IN LARO.;2 Lara,1 Mark,21 Mia;;Gaja Fila?,Matej Zemlji?,Zala Djuri?;2 3/8
40;40-09;Lj/Kozmeti?ni Salon;DAN-INT.;MERI SI IŠ?E LO?ITVENEGA ODVETNIKA  A OBET LO?ITVE JO JE PRIZADEL BOLJ  KOT SI JE PRIPRAVLJENA PRIZNATI.;7 Frenk,6 Meri,265 STATISTA PASAŽA D 2x 7.3.;STATISTA PASAŽA D 2x 7.3.;Gaber Trseglav,Vesna Pernar?i?; 5/8
40;40-10;Lj/Dolen?evo Stanovanje/Kabinet;DAN-INT.;SANJA JE ODLO?ENA  DA UGOTOVI RESNICO O O?ETOVI SMRTI. BB JI SVETUJE  NAJ PUSTI STVARI PRI MIRU  SICER...;19 Bb,258 Sanja;;Valter Dragan,Nina Rakovec;2
40;40-11;Lj/Pasaža/Lokal;DAN-INT.;JULIJA SE DOBI S PE?NIKOM. HO?E VIDET  KAJ IMA PE?NIK PROTI BB-JU  PREDEN SKLENETA POSEL. RENATO JU OPAZUJE.;10 Julija,15 Pe?nik,9 Renato,262 STATISTA PASAŽA A 2x 7.3.,263 STATIST LOKAL B 1x 7.3.,264 STATIST LOKAL C 1x 7.3.;STATISTA PASAŽA A 2x 7.3.,STATIST LOKAL B 1x 7.3.,STATIST LOKAL C 1x 7.3.;Sabina Kogovšek,Matija Rupel,Primož Vrhovec;3
40;40-12;Lj/Steinerjeva Klinika/Sprejemnica;DAN-INT.;MARK PRIZNA LARI  DA IMATA Z MIO TEŽAVE. MIRT PA STOPI NA MINO  KO LARI PREDLAGA  DA BI SE POGOVORILA O JANI.;2 Lara,1 Mark,257 Dr. Mirt;;Gaja Fila?,Matej Zemlji?,Žiga Udir;3 1/4
40;40-13;Lj/Dolen?evo Stanovanje/Kabinet;DAN-INT.;BB OPOZORI SANJO  NAJ NE VRTA V O?ETOVO SMRT  SICER JI LAHKO OTEŽI VRNITEV V AMERIKO.;19 Bb,258 Sanja;;Valter Dragan,Nina Rakovec;2 3/8
40;40-14;Lj/Pasaža/Lokal;DAN-INT.;PE?NIK POVE JULIJI  DA POTREBUJE ŠIFRO  ?E ŽELI VIDETI DOKUMENTE. PE?NIK JE PREPRI?AN  DA IMA ŠIFRO EDVARD.;10 Julija,15 Pe?nik,262 STATISTA PASAŽA A 2x 7.3.,263 STATIST LOKAL B 1x 7.3.,264 STATIST LOKAL C 1x 7.3.;STATISTA PASAŽA A 2x 7.3.,STATIST LOKAL B 1x 7.3.,STATIST LOKAL C 1x 7.3.;Sabina Kogovšek,Matija Rupel;1 3/8
40;40-15;Lj/Kozmeti?ni Salon;DAN-INT.;PARALELNI SCENI (TELEFONSKI POGOVOR) MERI POKLI?E SAŠKO IN SE JI POTOŽI. SAŠKA PROSI MERI  NAJ POŽRE PONOS IN SE BORI ZA NJEN IN FRENKOV ZAKON.;7 Frenk,6 Meri,5PS Saška PS,265 STATISTA PASAŽA D 2x 7.3.;STATISTA PASAŽA D 2x 7.3.;Gaber Trseglav,Vesna Pernar?i?,Mila Peršin;2
40;40-16;Kemp/Ex Renatova Parcela/Pred Prikolico;DAN-EXT.;PARALELNI SCENI (TELEFONSKI POGOVOR) MERI POKLI?E SAŠKO IN SE JI POTOŽI. SAŠKA PROSI MERI  NAJ POŽRE PONOS IN SE BORI ZA NJEN IN FRENKOV ZAKON.;5 Saška,6PS Meri PS,213 KEMP MANJ (3);KEMP MANJ (3);Mila Peršin,Vesna Pernar?i?;2
40;40-17;Lj/Kova?eva Mesnica;DAN-INT.;FRENK SE PREDAJA ŽALOSTNIM MISLIM  KO ZAGLEDA PRED MERIJINIM SALONOM - RENATA! FRENKA ZASKRBI ZA MERI.;7 Frenk,6 Meri,9 Renato,262 STATISTA PASAŽA A 2x 7.3.,264 STATIST LOKAL C 1x 7.3.;STATISTA PASAŽA A 2x 7.3.,STATIST LOKAL C 1x 7.3.;Gaber Trseglav,Vesna Pernar?i?,Primož Vrhovec; 5/8
40;40-18;Lj/Pasaža;DAN-INT.;MERI BI SE POBOTALA S FRENKOM  GA POVABI NA VE?ERJO. FRENK NIMA ?ASA ZANJO  SAJ SE MU MUDI ZA RENATOM.;7 Frenk,6 Meri,9 Renato,262 STATISTA PASAŽA A 2x 7.3.,264 STATIST LOKAL C 1x 7.3.;STATISTA PASAŽA A 2x 7.3.,STATIST LOKAL C 1x 7.3.;Gaber Trseglav,Vesna Pernar?i?,Primož Vrhovec;1
40;40-19;Lj/Steinerjeva Klinika/Sprejemnica;DAN-INT.;MARK POVE MII  DA BO DELAL NA KLINIKI POZNO V NO?. MIA SUMI  DA BO MARK PREŽIVEL VE?ER Z LARO.;2 Lara,1 Mark,21 Mia;;Gaja Fila?,Matej Zemlji?,Zala Djuri?;1 1/2
40;40-20;Kemp/Janina Parcela/Avtodom;DAN-INT./EXT.;JANA SE PREDAJA DEPRESIJI  KO JO PRESENETI NADA. NADA BI POMAGALA JANI  JANA SE NO?E POGOVARJATI Z NADO.;12 Jana,13OFF Nada Off;;Tanja Poto?nik,Aleksandra Balmazovi?;1 1/8
40;40-21;Lj/Edvardovo Stanovanje/Dnevna Soba;DAN-INT.;JULIJA IŠ?E ŠIFRO.;10 Julija;;Sabina Kogovšek; 1/2
40;40-22;Lj/Bb-Jeva Pisarna;DAN-INT.;BB NARO?I RENATU  NAJ SLEDI PE?NIKU IN SE DOKOPLJE DO KLJU?KA  PREDEN GA DOBI JULIJA.;19 Bb,9 Renato;;Valter Dragan,Primož Vrhovec; 7/8
40;40-23;Kemp/Janina Parcela/Pred Avtodomom;DAN-EXT.;NADA VZTRAJA PRED AVTODOMOM. JANA NAZADNJE POPUSTI IN PRIDE IZ AVTODOMA - IN SE ZJOKA V SESTRINEM OBJEMU.;12 Jana,13 Nada,213 KEMP MANJ (3);KEMP MANJ (3);Tanja Poto?nik,Aleksandra Balmazovi?;1
40;40-24;Lj/Steinerjeva Klinika/Sprejemnica;DAN-INT.;MIRT ODHAJA S KLINIKE SAM  PREPRI?AN  DA LARI NI DO NJEGOVE DRUŽBE. LARA GA PRESENETI S POVABILOM NA TRETJI ZMENEK.;2 Lara,257 Dr. Mirt;;Gaja Fila?,Žiga Udir; 7/8
40;40-25;Lj/Markova Garsonjera/Dnevni Del;DAN-INT.;MIA IZKORISTI MARKOVO ODSOTNOST ZA VE?ERNO DRUŽENJE Z ŽANOM.;21 Mia,253 Žan;;Zala Djuri?,Domen Novak;1 1/8
40;40-26;Lj/Steinerjeva Klinika/Pisarna/Ordinacija;NO?-INT.;MARK JE ŠE VEDNO V PISARNI. LOVI ROK ZA ODDAJO VLOGE NA RAZPIS.;1 Mark;;Matej Zemlji?; 1/4
40;40-27;Lj/Edvardovo Stanovanje/Dnevna Soba;NO?-INT.;JULIJA NAJDE ŠIFRO. ZRAVEN PA DOKUMENTE  KI JIH JE EDI ZBIRAL PROTI NJEJ.;10 Julija;;Sabina Kogovšek; 7/8
41;41-01;Lj/Steinerjeva Klinika/Pisarna/Ordinacija;NO?-INT.;MARK UGOTOVI  DA MU ZMANJKUJE ?ASA ZA PRIJAVO.;1 Mark;;Matej Zemlji?; 1/2
41;41-02;Lj/Markova Garsonjera/Dnevni Del;NO?-INT.; MII IN ŽANU ENA BUTELJKA NI BILA DOVOLJ?;21 Mia,253 Žan;;Zala Djuri?,Domen Novak;1 3/4
41;41-03;Lj/Steinerjeva Klinika/Pisarna/Ordinacija;NO?-INT.; MARK V ZADNJEM HIPU USPE ODDATI PRIJAVO NA RAZPIS.;1 Mark;;Matej Zemlji?; 3/8
41;41-04;Lj/Nadino Stanovanje/Dnevni Del;NO?-INT.; LARA PONUDI LEONU  DA NO? PREŽIVI PRI NJEJ... AMPAK NA KAV?U.;2 Lara,257 Dr. Mirt;;Gaja Fila?,Žiga Udir;1 5/8
41;41-05;Lj/Vila/Vhodna Veža s Stopniš?em;NO?-INT.; MARK SE VRA?A - BO ZALOTIL MIO IN ŽANA?;1 Mark;;Matej Zemlji?; 3/8
41;41-06;Lj/Markova Garsonjera/Dnevni Del;NO?-INT.; ŽANA NI VE? - A SLEDOVI NJEGOVEGA DRUŽENJA Z MIO SO OSTALI.;1 Mark,21 Mia;;Matej Zemlji?,Zala Djuri?; 3/4
41;41-07;Lj/Markova Garsonjera/Dnevni Del;DAN-INT.; MIA JE MARKU ZA DRUŽENJE Z LARO VRNILA Z ŽANOVIM OBISKOM  A UGOTOVI  DA JE MARK VE?ER PREŽIVEL SAM.;1 Mark,21 Mia;;Matej Zemlji?,Zala Djuri?;2 3/8
41;41-08;Lj/Nadino Stanovanje/Dnevni Del;DAN-INT.; LEON IN LARA PREŽIVITA PRVO - RAHLO NEPRIJETNO - SKUPNO JUTRO.;2 Lara,257 Dr. Mirt;;Gaja Fila?,Žiga Udir;1 5/8
41;41-09;Kemp/Janina Parcela/Avtodom;DAN-INT./EXT.;JANI GRE NA ŽIVCE NADINA JUTRANJA DOBRA VOLJA - SPOMINJA SE BLAŽA IN JE ZELO ŽALOSTNA.;12 Jana,13 Nada;;Tanja Poto?nik,Aleksandra Balmazovi?;1 3/4
41;41-10;Lj/Steinerjeva Klinika/Sprejemnica;DAN-INT.; LEON OBLJUBI  DA BO ORGANIZIRAL SESTANEK S SVOJIMI STARŠI.;2 Lara,1 Mark,257 Dr. Mirt;;Gaja Fila?,Matej Zemlji?,Žiga Udir;2 1/4
41;41-11;Kemp/Naravna plaža;DAN-EXT.;NADA SE SPOMNI  DA IMA DANAŠNJI DAN POSEBEN POMEN!;13 Nada,213 KEMP MANJ (3);KEMP MANJ (3);Aleksandra Balmazovi?; 1/2
41;41-12;Kemp/Edvardova parcela/Pred prikolico;DAN-EXT.;JULIJA OD EDIJA ZAHTEVA POJASNILO  ZAKAJ JE BRSKAL PO NJENIH SLUŽBENIH DOKUMENTIH?;3 Edvard,10 Julija,206 KEMP STANDARD (7);KEMP STANDARD (7);Aleš Vali?,Sabina Kogovšek;1 1/8
41;41-13;Lj/Steinerjeva Klinika/Pisarna/Ordinacija;DAN-INT.;MIO OB POGLEDU NA OSTANKE MARKOVEGA NO?NEGA TRUDA ZAPE?E VEST.;21 Mia,257 Dr. Mirt;;Zala Djuri?,Žiga Udir;2 3/8
41;41-14;Kemp/Restavracija;DAN-INT.; NADA PROSI HRVOJA ZA UPORABO NJEGOVE KUHINJE - ZA NEKAJ POSEBNEGA.;14 Hrvoje,13 Nada,244 2 GOSTA RESTAVRACIJE;2 GOSTA RESTAVRACIJE;Alen Šalinovi?,Aleksandra Balmazovi?;2 1/2
41;41-15;Lj/Steinerjeva Klinika/Shramba;DAN-INT.; MIO PESTI SLABA VEST  ZATO SE PRIDE OPRAVI?IT MARKU.;1 Mark,21 Mia;;Matej Zemlji?,Zala Djuri?;2 1/4
41;41-16;Kemp/Edvardova parcela/Pred prikolico;DAN-EXT.; JULIJA Z EDIJEM NO?E IMETI VE? OPRAVKA IN ODHAJA.;3 Edvard,10 Julija,206 KEMP STANDARD (7);KEMP STANDARD (7);Aleš Vali?,Sabina Kogovšek;2 1/2
41;41-17;Lj/Steinerjeva Klinika/Sprejemnica;DAN-INT.; MIRT PRESENETI MARKA IN LARO - NA SESTANEK ZA ZEMLJIŠ?E GREJO LAHKO ŽE DANES.;2 Lara,1 Mark,257 Dr. Mirt;;Gaja Fila?,Matej Zemlji?,Žiga Udir;1 1/8
41;41-18;Kemp/Pred recepcijo;DAN-EXT.; JULIJA BESNA ODHAJA DOMOV  A JO PRI VHODU V KEMP PRESENETITA DAVID IN ELA.;10 Julija,16 Ela,11 David,206 KEMP STANDARD (7);KEMP STANDARD (7);Sabina Kogovšek,Mei Rabi?,Blaž Vali?;1 3/4
41;41-19;Kemp/Edvardova parcela/Pred prikolico;DAN-EXT.; EDI POVE DAVIDU  DA GA JE JULIJA RAZKRINKALA IN SE MU PONOVNO ODREKLA.;3 Edvard,11 David,206 KEMP STANDARD (7);KEMP STANDARD (7);Aleš Vali?,Blaž Vali?;2 1/2
41;41-20;Kemp/Bar Na Plaži;DAN-EXT.; HRVOJE SE ?UDI  ZAKAJ SE NADA NE UKVARJA Z JANO. DINO JE POLN IDEJ.;14 Hrvoje,4 Dino,206 KEMP STANDARD (7),245 GOST BARA;KEMP STANDARD (7),GOST BARA;Alen Šalinovi?,Matino Antunovi?;2 3/8
41;41-21;Kemp/Janina Parcela/Pred Avtodomom;DAN-EXT.; JANA JE LE VSTALA IZ POSTELJE - NADE PA NIKJER.;12 Jana,206 KEMP STANDARD (7);KEMP STANDARD (7);Tanja Poto?nik; 1/2
41;41-22;Kemp/Janina Parcela/Avtodom;DAN-INT./EXT.;JANA JE OSAMLJENA IN SESTRADANA - ZAVLE?E SE NAZAJ V POSTELJO.;12 Jana;;Tanja Poto?nik; 5/8
41;41-23;Kemp/Naravna plaža;DAN-EXT.;DAVID BI RAD JULIJI POJASNIL IN OPRAVI?IL EDIJEVA DEJANJA  A JULIJA ZANJ NIMA POSLUHA.;10 Julija,16 Ela,11 David,206 KEMP STANDARD (7);KEMP STANDARD (7);Sabina Kogovšek,Mei Rabi?,Blaž Vali?;3 3/8
41;41-24;Lj/Steinerjeva Klinika/Pisarna/Ordinacija;DAN-INT.;MIA SE ŽELI ODKUPITI MARKU S POZORNIM PRESENE?ENJEM.;2 Lara,1 Mark,21 Mia,257 Dr. Mirt;;Gaja Fila?,Matej Zemlji?,Zala Djuri?,Žiga Udir;1 1/8
41;41-25;Kemp/Janina Parcela/Avtodom;DAN-INT./EXT.;NADA PRESENETI JANO S PRAV POSEBNO JEDJO. JANA JE GANJENA  KER NADA VENDARLE NI POZABILA NA OBLETNICO.;12 Jana,13 Nada;;Tanja Poto?nik,Aleksandra Balmazovi?;1 1/4
41;41-26;Lj/Steinerjeva Klinika/Pisarna/Ordinacija;DAN-INT.; MARK NAMESTO NA OBLJUBLJENO KOSILO Z MIO ODIDE NA SESTANEK Z MIRTOVIMI STARŠI.;2 Lara,1 Mark,21 Mia,257 Dr. Mirt;;Gaja Fila?,Matej Zemlji?,Zala Djuri?,Žiga Udir;1
41;41-27;Kemp/Naravna plaža;DAN-EXT.;JULIJA IZVE  DA SE JE EDI ŽRTVOVAL ZANJO.;10 Julija,16 Ela,11 David,206 KEMP STANDARD (7);KEMP STANDARD (7);Sabina Kogovšek,Mei Rabi?,Blaž Vali?;1 1/2
42;42-01;Kemp/Janina Parcela/Pred Avtodomom;DAN-EXT.;JANA JE GANJENA NAD NADINO GESTO  AMPAK NADINA RIŽOTA JE OBUPNA.;12 Jana,13 Nada,213 KEMP MANJ (3);KEMP MANJ (3);Tanja Poto?nik,Aleksandra Balmazovi?;1 1/2
42;42-02;Kemp/Naravna plaža;DAN-EXT.;JULIJA JE JEZNA NASE  KER JE DOVOLILA  DA JO ZLORABIJO ZA GOLJUFIJO. DAVID PA JE OLAJŠAN  KER JULIJA O?ITNO NI KRIVA.;10 Julija,11 David,213 KEMP MANJ (3);KEMP MANJ (3);Sabina Kogovšek,Blaž Vali?;1 5/8
42;42-03;Kemp/Janina Parcela/Pred Avtodomom;DAN-EXT.;JANA BO NAU?ILA NADO  KAKO SKUHATI RIŽOTO. NADA BI RADA JANO RAZVESELILA ŠE Z ENIM PRESENE?ENJEM  ZATO POKLI?E LARO.;12 Jana,13 Nada,213 KEMP MANJ (3);KEMP MANJ (3);Tanja Poto?nik,Aleksandra Balmazovi?;1
42;42-04;Lj/Kmetija/Med Travniki/Pod Jablano;DAN-EXT.;LARO MED OGLEDOM LOKACIJE ZA VRTI?KE ZNERVIRA NADIN KLIC.;2 Lara,1 Mark,257 Dr. Mirt;;Gaja Fila?,Matej Zemlji?,Žiga Udir;1 1/2
42;42-05;Kemp/Edvardova parcela/Pred prikolico;DAN-EXT.;JULIJA SE ZAHVALI EDVARDU  KER SE JE ŽRTVOVAL ZANJO. O?E IN H?I SE POBOTATA.;3 Edvard,10 Julija,206 KEMP STANDARD (7);KEMP STANDARD (7);Aleš Vali?,Sabina Kogovšek;1 5/8
42;42-06;Kemp/Restavracija;DAN-INT.; JANA PRIDE PROSIT HRVOJA ZA SESTAVINE ZA RIŽOTO. HRVOJE JE VESEL  DA SE JE JANI VRNILA VOLJA DO ŽIVLJENJA. ;14 Hrvoje,12 Jana,5 Saška;;Alen Šalinovi?,Tanja Poto?nik,Mila Peršin;2 7/8
42;42-07;Lj/Kmetija/Med Travniki;DAN-EXT.;LEON USPEŠNO POMIRI LARO  MARKA PA PREPLAVLJA LJUBOSUMJE.;2 Lara,1 Mark,257 Dr. Mirt;;Gaja Fila?,Matej Zemlji?,Žiga Udir;1 1/4
42;42-08;Lj/Markova Garsonjera/Dnevni Del;DAN-INT.;MIA POVABI ŽANA NA SARDELCE - IN PRIJATELJSKO DRUŽENJE.;21 Mia,253 Žan;;Zala Djuri?,Domen Novak;1 1/8
42;42-09;Kemp/Bar Na Plaži;DAN-EXT.;PARALELNI SCENI (TELEFONSKI POGOVOR) SAŠKA PREDLAGA MERI  DA S FRENKOM PRIDETA V KEMP IN K NADI NA TERAPIJO. A NJEN PREDLOG NE PADE NA PLODNA TLA.;4 Dino,5 Saška,6PS Meri PS,213 KEMP MANJ (3);KEMP MANJ (3);Matino Antunovi?,Mila Peršin,Vesna Pernar?i?;3 1/8
42;42-10;Lj/Kozmeti?ni Salon;DAN-INT.;PARALELNI SCENI (TELEFONSKI POGOVOR) SAŠKA PREDLAGA MERI  DA S FRENKOM PRIDETA V KEMP IN K NADI NA TERAPIJO. A NJEN PREDLOG NE PADE NA PLODNA TLA.;7 Frenk,6 Meri,5PS Saška PS;;Gaber Trseglav,Vesna Pernar?i?,Mila Peršin;3 1/8
42;42-11;Lj/Kmetija;DAN-EXT.;MIRTOVA MAMA JE VESELA  DA JE BODO?A SNAHA ZAGRETA ZA KMETOVANJE. JE PRIPRAVLJENA ODSTOPIT ZEMLJIŠ?E ZA VRTI?EK.;2 Lara,1 Mark,257 Dr. Mirt,260 Helena;;Gaja Fila?,Matej Zemlji?,Žiga Udir;2 1/8
42;42-12;Kemp/Janina Parcela/Pred Avtodomom;DAN-EXT.;SESTRI MED KUHANJEM RAZ?ISTITA STARE ZAMERE. NADA OBLJUBI JANI  DA BOSTA SKUPAJ REŠILI JANIN PROBLEM.;12 Jana,13 Nada,213 KEMP MANJ (3);KEMP MANJ (3);Tanja Poto?nik,Aleksandra Balmazovi?;3
42;42-13;Lj/Pasaža/Lokal;DAN-INT.;FRENK ZAUPA BORUTU  DA GA SKRBI  DA RENATO NEKAJ NAKLEPA PROTI MERI. FRENK MORA ZAŠ?ITITI SVOJO ŽENSKO.;7 Frenk,23 Borut,233 LOKAL C 2x 25.2.,235 gostja lokala 1x 25.2. (mlad par),236 gost lokala 1x 25.2.;LOKAL C 2x 25.2.,gostja lokala 1x 25.2. (mlad par),gost lokala 1x 25.2.;Gaber Trseglav,Miha Rodman;2 3/4
42;42-14;Lj/Kmetija;DAN-EXT.;MIRTOVA MAMA NE ŽELI IMETI OPRAVKA S KLOŠARJI. DOGOVOR O ZEMLJIŠ?U ZA VRTI?EK PADE V VODO.;2 Lara,1 Mark,257 Dr. Mirt,260 Helena;;Gaja Fila?,Matej Zemlji?,Žiga Udir;1 1/4
42;42-15;Kemp/Edvardova parcela/Pred prikolico;DAN-EXT.;EDI VERJAME JULIJI. SKUPAJ BOSTA ZDRUŽILA MO?I PROTI MEDICINSKI MAFIJI. ELA PROSI JULIJO  DA OSTANE NA VE?ERJI.;3 Edvard,10 Julija,16 Ela,11 David,206 KEMP STANDARD (7);KEMP STANDARD (7);Aleš Vali?,Sabina Kogovšek,Mei Rabi?,Blaž Vali?;2 7/8
42;42-16;Lj/Kozmeti?ni Salon;DAN-INT.;MERI IMA DOVOLJ FRENKA  KI ZANEMARJA MESNICO IN SPET NEKAM ODHAJA. STOPI ZA NJIM.;7 Frenk,6 Meri,237 stranka salon 1x  25.2.;stranka salon 1x  25.2.;Gaber Trseglav,Vesna Pernar?i?; 3/4
42;42-17;Lj/Pasaža;DAN-INT.;FRENK NE MISLI POLAGAT MERI RA?UNOV  SAJ SE MU SPET MUDI.;7 Frenk,6 Meri,233 LOKAL C 2x 25.2.,234 PASAŽA D 1x 25.2.,237 stranka salon 1x  25.2.;LOKAL C 2x 25.2.,PASAŽA D 1x 25.2.,stranka salon 1x  25.2.;Gaber Trseglav,Vesna Pernar?i?;1 1/8
42;42-18;Lj/Bb-Jeva Pisarna;DAN-INT.;BB DOBI NA MIZO MARKOVO PRIJAVO NA RAZPIS.;19 Bb,358 Referent;;Valter Dragan,Sre?ko Kermavner;1 3/8
42;42-19;Lj/Markova Garsonjera/Dnevni Del;DAN-INT.;MARK IZVE  DA JE BIL ŽAN SPET PRI MII. MIA JE RAZO?ARANA  KER MARK NI LJUBOSUMEN ZARADI ŽANOVEGA PONOVNEGA OBISKA.;1 Mark,21 Mia;;Matej Zemlji?,Zala Djuri?;2 1/8
42;42-20;Lj/Pasaža/Lokal;DAN-INT.;MERI ZASLIŠUJE BORUTA  KAJ PO?NE FRENK. BORUT MOL?I  MERI PA POSUMI  DA IMA FRENK DRUGO ŽENSKO.;6 Meri,23 Borut,207 NI STATISTOV;NI STATISTOV;Vesna Pernar?i?,Miha Rodman;1 3/8
42;42-21;Lj/Bb-Jeva Pisarna;DAN-INT.;BB PO OVINKIH NAKAŽE KOLEGU  DA NE ŽELI  DA MARK DOBI DENARNA RAZPISU.;19 Bb,358 Referent;;Valter Dragan,Sre?ko Kermavner;1 1/8
42;42-22;Kemp/Edvardova parcela/Pred prikolico;DAN-EXT.;JULIJA UŽIVA V DRUŽINSKI VE?ERJI  ELA PA JE VESELA  DA SE STARŠA PO DOLGEM ?ASU SPET SMEJITA SKUPAJ.;3 Edvard,10 Julija,16 Ela,11 David,206 KEMP STANDARD (7);KEMP STANDARD (7);Aleš Vali?,Sabina Kogovšek,Mei Rabi?,Blaž Vali?;1 5/8
42;42-23;Kemp/Janina Parcela/Pred Avtodomom;DAN-EXT.;JANA JE VESELA  DA IMA LARA NOVO SIMPATIJO. JO ZANIMA  KAJ SE DOGAJA V NADINEM ŽIVLJENJU. NADA JE ŠE VEDNO SAMSKA.;12 Jana,13 Nada,213 KEMP MANJ (3);KEMP MANJ (3);Tanja Poto?nik,Aleksandra Balmazovi?;2 1/4
42;42-24;Lj/Nadino Stanovanje/Dnevni Del;NO?-INT.;LARA DOBI NADINO FOTOGRAFIJO Z VE?ERJE. SE ZASEKIRA  KER JE POZABILA NA OBLETNICO BLAŽEVE SMRTI.;2 Lara,257 Dr. Mirt;;Gaja Fila?,Žiga Udir;1 1/8
42;42-25;Kemp/Pred recepcijo;NO?-EXT.;DAVID POSPREMI JULIJO IZ KEMPA. JULIJA  RAZNEŽENA ZARADI PRIJETNEGA DRUŽINSKEGA VE?ERA  GA POLJUBI.;10 Julija,11 David,207 NI STATISTOV;NI STATISTOV;Sabina Kogovšek,Blaž Vali?;1 5/8
43;43-01;Lj/Nadino Stanovanje/Dnevni Del;NO?-INT.;LARA ZARADI POZABLJENE OBLETNICE POTREBUJE LEONOVO TOLAŽBO.;2 Lara,257 Dr. Mirt;;Gaja Fila?,Žiga Udir;1
43;43-02;Kemp/Edvardova parcela/Pred prikolico;DAN-EXT.; EDVARD  JULIJA IN DAVID POSTAJAJO EKIPA - NA?RTUJEJO NASLEDNJI KORAK V BOJU PROTI BB-JU.;3 Edvard,10 Julija,11 David,206 KEMP STANDARD (7);KEMP STANDARD (7);Aleš Vali?,Sabina Kogovšek,Blaž Vali?;1 3/8
43;43-03;Lj/Nadino Stanovanje/Dnevni Del;DAN-INT.; LARA POTREBUJE DAN ZASE  ZATO NE GRE V SLUŽBO.;2 Lara,257 Dr. Mirt;;Gaja Fila?,Žiga Udir;1 1/2
43;43-04;Kemp/Janina Parcela/Pred Avtodomom;DAN-EXT.; JANA SI JE OPOMOGLA - TAKOJ HO?E V AKCIJO REŠEVANJA SVOJIH FINANC IN ?RTOVE LAHKOMISELNOSTI  A JO NADA USTAVI.;12 Jana,13 Nada,206 KEMP STANDARD (7);KEMP STANDARD (7);Tanja Poto?nik,Aleksandra Balmazovi?;2 5/8
43;43-05;Lj/Steinerjeva Klinika/Pisarna/Ordinacija;DAN-INT.;MARK UGOTOVI  DA SO MU ZAVRNILI PRIJAVO NA RAZPIS.;1 Mark,257 Dr. Mirt;;Matej Zemlji?,Žiga Udir;1 1/8
43;43-06;Kemp/Edvardova parcela/Pred prikolico;DAN-EXT.; JULIJA SE S PE?NIKOM DOGOVORI ZA PRIMOPREDAJO USB KLJU?A  DAVID PA JI PONUDI POMO? S FARMAKISSOM.;3 Edvard,10 Julija,11 David,206 KEMP STANDARD (7);KEMP STANDARD (7);Aleš Vali?,Sabina Kogovšek,Blaž Vali?;1 7/8
43;43-07;Lj/Steinerjeva Klinika/Pisarna/Ordinacija;DAN-INT.;MARK UGOTOVI  DA JE BAN?NI RA?UN KLINIKE IZPRAZNJEN.;1 Mark;;Matej Zemlji?; 3/4
43;43-08;Lj/Bistro Lotus;DAN-INT.; FRENK ZASLEDUJE RENATA NA SESTANEK Z BB-JEM.;7 Frenk,9 Renato,209 STATISTI LOTUS A 6x 9.4.,367 Natakar;STATISTI LOTUS A 6x 9.4.;Gaber Trseglav,Primož Vrhovec,Dario Noži? Serini Dacho;1 1/4
43;43-09;Lj/Pasaža;DAN-INT.;FRENK JE POZABIL NA KEVINA  KAR MERI SAMO ŠE BOLJ UTRDI V PREPRI?ANJU  DA JO FRENK VARA.;6 Meri,23 Borut,17 Kevin,232 PASAŽA B 3x 25.2.;PASAŽA B 3x 25.2.;Vesna Pernar?i?,Miha Rodman,Patrik Novak;2
43;43-10;Lj/Steinerjeva Klinika/Pisarna/Ordinacija;DAN-INT.; MARK HO?E GOVORIT Z JULIJO  A JULIJA ZANJ NIMA ?ASA. SE BOSTA POGOVORILA  KO SE VRNE IZ KEMPA.;1 Mark,10OFF Julija Off;;Matej Zemlji?,Sabina Kogovšek; 3/4
43;43-11;Kemp/Sanitarije/Pred Sanitarijami;DAN-EXT.;PRVO SRE?ANJE DAVIDA IN NADE PO ENEM LETU.;11 David,13 Nada,213 KEMP MANJ (3);KEMP MANJ (3);Blaž Vali?,Aleksandra Balmazovi?; 5/8
43;43-12;Lj/Bistro Lotus/Separe;DAN-INT.;RENATO SPORO?I BB-JU  DA BO JUTRI PRIMOPREDAJA KLJU?KA. FRENKA PA ZMOTI MERIJIN KLIC.;19 Bb,7 Frenk,9 Renato,209 STATISTI LOTUS A 6x 9.4.,367 Natakar;STATISTI LOTUS A 6x 9.4.;Valter Dragan,Gaber Trseglav,Primož Vrhovec,Dario Noži? Serini Dacho;1 3/4
43;43-13;Lj/Pasaža/Pred mesnico;DAN-INT.; MERI KLI?E FRENKA - FRENK JI PREKINE.;6 Meri,207 NI STATISTOV;NI STATISTOV;Vesna Pernar?i?; 5/8
43;43-14;Lj/Bistro Lotus/Separe;DAN-INT.; RENATO SE NEVEDE OTRESE SVOJEGA AMATERSKEGA ZASLEDOVALCA FRENKA.;19 Bb,7 Frenk,9 Renato,209 STATISTI LOTUS A 6x 9.4.,367 Natakar;STATISTI LOTUS A 6x 9.4.;Valter Dragan,Gaber Trseglav,Primož Vrhovec,Dario Noži? Serini Dacho;1 1/2
43;43-15;Kemp/Pot Mimo Sanitarij;DAN-EXT.; DAVID POVABI NADO NA PIJA?O.;11 David,13 Nada,213 KEMP MANJ (3);KEMP MANJ (3);Blaž Vali?,Aleksandra Balmazovi?;1 7/8
43;43-16;Lj/Pasaža/Lokal;DAN-INT.; ŽAN PRIKRIVA NINI SVOJE DRUŽENJE Z MIO.;18 Nina,253 Žan,249 STATIST B1,250 STATIST B2;STATIST B1,STATIST B2;Melani Mekicar,Domen Novak;2 1/4
