Epizoda;Prizor;Lokacija;Okoliš?ine;Opis;Liki;Statisti;Igralci;Število strani scenarija
53;53-05;Lj/Bb-Jeva Pisarna;DAN-INT.; JULIJA JE PRISILJENA PRIZNATI  DA JE BB MARKOV O?E.;1 Mark,10 Julija,19 Bb;;Matej Zemlji?,Sabina Kogovšek,Valter Dragan;1 3/4
53;53-06;Lj/Nadino Stanovanje/Dnevni Del;DAN-INT.; JANA JE ODLO?ENA  DA BO PRODALA STANOVANJE  A SE LARA S TEM NIKAKOR NE MORE SPRIJAZNITI.;2 Lara,12 Jana;;Gaja Fila?,Tanja Poto?nik;2
53;53-07;Kemp/Bar Na Plaži;DAN-EXT.; NADA SE ODLO?I  DA BO STAVILA PET TISO?AKOV NA NOGOMETNO TEKMO.;4 Dino,13 Nada;;Matino Antunovi?,Aleksandra Balmazovi?;3 7/8
53;53-08;Lj/Bb-Jeva Pisarna;DAN-INT.; JULIJA BB-JU NE BO OSTALA DOLŽNA ZA TO  DA SE JE SAMOVOLJNO MARKU RAZODEL KOT NJEGOV O?E.;10 Julija,19 Bb;;Sabina Kogovšek,Valter Dragan;1 5/8
53;53-09;Lj/Bistro Lotus;DAN-INT.; ZA MIO STVARI NISO TAKO PREPROSTE. ?EPRAV IMA ŽANA RADA  NE MORE KAR ?EZ NO? PUSTITI MARKA.;21 Mia,253 Žan,209 STATISTI LOTUS A 6x 9.4.,367 Natakar;STATISTI LOTUS A 6x 9.4.;Zala Djuri?,Domen Novak,Dario Noži? Serini Dacho;1 1/4
53;53-10;Lj/Vila/Vhodna Veža s Stopniš?em;DAN-INT.;EDI JE ENAKO KOT MARK ŠOKIRAN NAD INFORMACIJO  DA JE BB MARKOV O?E.;1 Mark,3 Edvard;;Matej Zemlji?,Aleš Vali?;2
53;53-11;Kemp/Bar Na Plaži;DAN-EXT.; NADA KLJUB DINOVIM DVOMOM NE ODSTOPA - STAVILA BO VSEH 5000 EUR.;4 Dino,13 Nada,218 KEMP STANDARD (7) - B;KEMP STANDARD (7) - B;Matino Antunovi?,Aleksandra Balmazovi?;1 3/4
53;53-12;Lj/Nadino Stanovanje/Kuhinja;DAN-INT.; LARA LE SPREJME NEIZOGIBNO - Z JANO BOSTA PRODALI STANOVANJE.;2 Lara,12 Jana;;Gaja Fila?,Tanja Poto?nik;1 3/8
53;53-13;Lj/Bistro Lotus;DAN-INT.; MIA LE SKLENE  DA BO PUSTILA MARKA  ZATO DA BOSTA LAHKO Z ŽANOM PAR.;21 Mia,253 Žan,209 STATISTI LOTUS A 6x 9.4.,367 Natakar;STATISTI LOTUS A 6x 9.4.;Zala Djuri?,Domen Novak,Dario Noži? Serini Dacho;2 1/4
53;53-14;Kemp/Kova?eva Parcela/Prikolica;DAN-INT./EXT.;FRENK BI RAZVAJAL MERI  ZATO JO BO PELJAL NA ROMANTI?NO VE?ERJO.;7 Frenk,6 Meri;;Gaber Trseglav,Vesna Pernar?i?;1 1/8
53;53-15;Kemp/Restavracija;DAN-INT.; DINO ZVLE?E TUŽNEGA HRVOJA GLEDAT NOGOMETNO TEKMO.;14 Hrvoje,4 Dino,274 kemp restavracija (4);kemp restavracija (4);Alen Šalinovi?,Matino Antunovi?;1 7/8
53;53-16;Lj/Markova Garsonjera/Dnevni Del;NO?-INT.; MIA ŽELI KON?ATI ZVEZO Z MARKOM  A JE MARK ZARADI LASTNIH TEŽAV NE PUSTI DO BESEDE.;1 Mark,21 Mia,10OFF Julija Off;;Matej Zemlji?,Zala Djuri?,Sabina Kogovšek;1 1/4
53;53-17;Lj/Nadino Stanovanje/Kuhinja;NO?-INT.;LARA IN JANA OBJAVITA OGLAS ZA PRODAJO STANOVANJA.;2 Lara,12 Jana;;Gaja Fila?,Tanja Poto?nik;1 1/8
53;53-18;Kemp/Klubska soba;NO?-INT.;SAŠKA IŠ?E DINA ZA VARSTVO TONIJA  A KO UGOTOVI  KOLIKO DENARJA JE V IGRI  TUDI ONA PRISEDE K OGLEDU TEKME.;14 Hrvoje,4 Dino,5 Saška,13 Nada,1000 Vozi?ek,371OFF Komentator  hrvaškogovore?i Off;;Alen Šalinovi?,Matino Antunovi?,Mila Peršin,Aleksandra Balmazovi?;3 1/8
53;53-19;Kemp/Restavracija;NO?-INT.; IZ ROMANTI?NE VE?ERJE NE BO NI? - RESTAVRACIJA JE ZAPRTA.;7 Frenk,6 Meri,14OFF Hrvoje Off,4OFF Dino Off,13OFF Nada Off,5OFF Saška Off;;Gaber Trseglav,Vesna Pernar?i?,Alen Šalinovi?,Matino Antunovi?,Aleksandra Balmazovi?,Mila Peršin; 7/8
53;53-20;Lj/Julijino Stanovanje/Kuhinja;NO?-INT.; EDVARD OD JULIJE ŽELI POJASNILA - JE BB RES MARKOV O?E?;3 Edvard,10 Julija;;Aleš Vali?,Sabina Kogovšek; 3/4
53;53-21;Lj/Markova Garsonjera/Dnevni Del;NO?-INT.; MARK JE ZARADI DRUŽINSKIH TEŽAV PREVE? RAZSUT  DA BI GA MIA IMELA SRCE ŠE DODATNO POTOL?I - NE KON?A ZVEZE Z NJIM.;1 Mark,21 Mia;;Matej Zemlji?,Zala Djuri?;2
53;53-22;Kemp/Klubska soba;NO?-INT.; FRENK IN MERI SE JEZITA ZARADI ZAPRTE RESTAVRACIJE  A NA KONCU TUDI ZA?NETA NAVIJATI ZA NADINIH 50.000 EVROV.;14 Hrvoje,7 Frenk,4 Dino,5 Saška,6 Meri,13 Nada,1000 Vozi?ek,371OFF Komentator  hrvaškogovore?i Off;;Alen Šalinovi?,Gaber Trseglav,Matino Antunovi?,Mila Peršin,Vesna Pernar?i?,Aleksandra Balmazovi?;2 3/8
53;53-23;Lj/Julijino Stanovanje/Dnevna Soba;NO?-INT.; JULIJA JE SKRIVALA BB-JA KOT MARKOVEGA O?ETA ZARADI STRAHU PRED EDIJEVO REAKCIJO. JE BIL EDI SLAB O?E?;3 Edvard,10 Julija;;Aleš Vali?,Sabina Kogovšek;1 3/4
53;53-24;Kemp/Klubska soba;NO?-INT.; VSE KAŽE NA ZMAGO NADINEGA MOŠTVA... DOKLER NASPROTNIK NE IZENA?I.;14 Hrvoje,7 Frenk,4 Dino,5 Saška,6 Meri,13 Nada,1000 Vozi?ek,371OFF Komentator  hrvaškogovore?i Off;;Alen Šalinovi?,Gaber Trseglav,Matino Antunovi?,Mila Peršin,Vesna Pernar?i?,Aleksandra Balmazovi?;1 7/8
53;53-25;Lj/Bb-Jeva Pisarna;NO?-INT.;BB OPERATIVCU NARO?I  DA ZASLEDUJE SANJO.;19 Bb,250 Operativec;;Valter Dragan,Damjan M. Trbovc; 3/4
53;53-26;Lj/Edvardovo Stanovanje/Dnevna Soba;NO?-INT.; NA EDVARDOVA VRATA POZNO ZVE?ER POTRKA - SANJA.;3 Edvard,258OFF Sanja Off;;Aleš Vali?,Nina Rakovec; 1/2
54;1;;DAN-INT.;;;;;0
54;54-01;Kemp/Klubska soba;NO?-INT.; TEKMA JE IZGUBLJENA. NADIN DENAR PA TUDI. ;14 Hrvoje,7 Frenk,4 Dino,5 Saška,6 Meri,13 Nada,1000 Vozi?ek;;Alen Šalinovi?,Gaber Trseglav,Matino Antunovi?,Mila Peršin,Vesna Pernar?i?,Aleksandra Balmazovi?;1 3/4
54;54-02;Lj/Edvardovo Stanovanje/Dnevna Soba;NO?-INT.; SANJA NE MORE DOMOV  SICER BO UBILA PE?NIKA. EDVARD JI PONUDI PRENO?IŠ?E IN TOLAŽBO. ;3 Edvard,258 Sanja;;Aleš Vali?,Nina Rakovec;1 5/8
54;54-03;Lj/Markova Garsonjera/Spalni Del;DAN-INT.;MIA SPORO?I ŽANU  DA NE MORE ZAPUSTITI MARKA.;1 Mark,21 Mia;;Matej Zemlji?,Zala Djuri?; 5/8
54;54-04;Lj/Edvardovo Stanovanje/Jedilnica;DAN-INT.;EDI DOBI REZULTATE OBDUKCIJE - STANE JE BIL UMORJEN. SANJA ŽELI DOBITI OD PE?NIKA POTRDITEV  DA JE UMOR NARO?IL BB.;3 Edvard,258 Sanja;;Aleš Vali?,Nina Rakovec;2 3/8
54;54-05;Lj/Julijino Stanovanje/Dnevna Soba;DAN-INT.;DAVID RAZUMEVAJO?E SPREJME NOVICO O TEM  DA JE BB MARKOV O?E.;10 Julija,11 David;;Sabina Kogovšek,Blaž Vali?;2
54;54-06;Lj/Markova Garsonjera/Dnevni Del;DAN-INT.;MARK JE ODLO?EN  DA PREKINE S FAMILIJO. JE VESEL  DA IMA VSAJ MIO.;1 Mark,21 Mia;;Matej Zemlji?,Zala Djuri?;2 1/4
54;54-07;Lj/Nadino stanovanje/Jedilnica;DAN-INT.;LARA IN JANA SE SOO?ATA Z IZGUBO STANOVANJA. LEON PRESENETI LARO S POVABILOM  DA SE PRESELI K NJEMU.;2 Lara,12 Jana,257 Dr. Mirt;;Gaja Fila?,Tanja Poto?nik,Žiga Udir;2 3/8
54;54-08;Lj/Julijino Stanovanje/Dnevna Soba;DAN-INT.; JULIJI JE ŽAL  DA JE DAVIDA IZPUSTILA IZ ROK  SAJ GA ŠE VEDNO LJUBI. JULIJA POLJUBI DAVIDA.;10 Julija,11 David;;Sabina Kogovšek,Blaž Vali?;1 3/4
54;54-09;Kemp/Janina Parcela/Pred Avtodomom;DAN-EXT.;NADA PRED ODHODOM IZ KEMPA HRVOJA PROSI  ALI JI LAHKO POMAGA PRODATI JANIN AVTODOM.;14 Hrvoje,13 Nada;;Alen Šalinovi?,Aleksandra Balmazovi?; 7/8
54;54-10;Lj/Nadino stanovanje/Jedilnica;DAN-INT.;LARA POTREBUJE RAZMISLEK O LEONOVEM PREDLOGU  DA SE PRESELI K NJEMU.;2 Lara,12 Jana,257 Dr. Mirt;;Gaja Fila?,Tanja Poto?nik,Žiga Udir;2
54;54-11;Lj/Julijino Stanovanje/Dnevna Soba;DAN-INT.; JULIJA DOŽIVI HLADEN TUŠ. DAVID SE NE BO VRNIL V NJEN OBJEM  SAJ JE NJEGOVO SRCE DRUGJE. ;10 Julija,11 David;;Sabina Kogovšek,Blaž Vali?;1 3/8
54;54-12;Lj/Nadino stanovanje/Jedilnica;DAN-INT.;JANO POKLI?E KUPEC. DOLEN?EVI DEKLETI STA PRESENE?ENI NAD HITRIM ODZIVOM NA OGLAS ZA PRODAJO STANOVANJA.;2 Lara,12 Jana;;Gaja Fila?,Tanja Poto?nik;2
54;54-13;Lj/Steinerjeva Klinika/Pisarna/Ordinacija;DAN-INT.;MARK DOBI DENAR Z RAZPISA  A GA ŽELI ZAVRNITI  KER GA JE DOBIL Z BB-JEVIM POSREDOVANJEM.;1 Mark,257 Dr. Mirt;;Matej Zemlji?,Žiga Udir;1 1/8
54;54-14;Lj/Dolen?evo Stanovanje/Dnevna Soba;DAN-INT.;SANJO DOMA PRI?AKA ZASKRBLJENI PE?NIK  KI ŽELI VEDETI  KJE JE BILA VSO NO?.;15 Pe?nik,258 Sanja;;Matija Rupel,Nina Rakovec;1 1/8
54;54-15;Lj/Nadino Stanovanje/Kuhinja;DAN-INT.;NADA SE VRNE IZ KEMPA S FIGAMI ZA JANO. NADI SE SMILI HRVOJE  JANI PA NADA  KI IMA O?ITNO SPET ZLOMLJENO SRCE.;2 Lara,12 Jana,13 Nada;;Gaja Fila?,Tanja Poto?nik,Aleksandra Balmazovi?;3
54;54-16;Kemp/Janina Parcela/Pred Avtodomom;DAN-EXT.;HRVOJU JE TEŽKO PRODATI JANIN AVTODOM  SAJ BO S TEM KONEC TUDI UPANJA  DA SE JANA VRNE V KEMP.;14 Hrvoje,4 Dino,206 KEMP STANDARD (7),1000 Vozi?ek;KEMP STANDARD (7);Alen Šalinovi?,Matino Antunovi?;2 3/4
54;54-17;Lj/Steinerjeva Klinika/Pisarna/Ordinacija;DAN-INT.;"LEON PREPRI?A MARKA  DA DENAR Z RAZPISA NI ""UMAZAN"". MARK PA IZVE  DA JANA PRODAJA STANOVANJE.";1 Mark,257 Dr. Mirt;;Matej Zemlji?,Žiga Udir;2 1/8
54;54-18;Lj/Dolen?evo Stanovanje/Kopalnica;DAN-INT.;SANJA SE LE STEŽKA ZADRŽUJE  DA NE OBRA?UNA S PE?NIKOM.;258 Sanja,15OFF Pe?nik Off;;Nina Rakovec,Matija Rupel; 7/8
54;54-19;Lj/Markova Garsonjera/Dnevni Del;DAN-INT.;PARALELNI SCENI (TELEFONSKI POGOVOR) MIA NAJDE POPOLNO STANOVANJE. MARK PRESTAVI OGLED  SAJ IMA POMEMBNEJŠE OPRAVKE.;21 Mia,1PS Mark PS;;Zala Djuri?,Matej Zemlji?;1 1/4
54;54-20;Lj/Steinerjeva Klinika/Pisarna/Ordinacija;DAN-INT.;PARALELNI SCENI (TELEFONSKI POGOVOR) MIA NAJDE POPOLNO STANOVANJE. MARK PRESTAVI OGLED  SAJ IMA POMEMBNEJŠE OPRAVKE.;1 Mark,21PS Mia PS;;Matej Zemlji?,Zala Djuri?;1 1/2
54;54-21;Kemp/Recepcija;DAN-INT.;DINO JE NAŠEL KUPCA ZA JANIN AVTODOM. HRVOJE LAŽE  DA JE AVTODOM ŽE PRODAN.;14 Hrvoje,4 Dino,1000 Vozi?ek,368 Prvi Pavšalist,369 Drugi Pavšalist;;Alen Šalinovi?,Matino Antunovi?;1 1/2
54;54-22;Lj/Nadino stanovanje/Jedilnica;DAN-INT.;MARK PRINESE JANI DENAR  S KATERIM BO LAHKO POPLA?ALA KREDIT IN OBDRŽALA STANOVANJE.;1 Mark,12 Jana;;Matej Zemlji?,Tanja Poto?nik;1 1/8
54;54-23;Lj/Markova Garsonjera/Dnevni Del;DAN-INT.;ŽAN PRIDE DO MIE - ŽELI ODGOVOR  ZAKAJ SI JE PREMISLILA.;21 Mia,253 Žan;;Zala Djuri?,Domen Novak; 7/8
54;54-24;Lj/Dolen?evo Stanovanje/Kuhinja;DAN-INT.;SANJA OBLJUBI PE?NIKU  DA BO ZBEŽALA Z NJIM V TUJINO. A ŽELI  DA JI POTRDI  DA JE BB NARO?IL UMOR NJENEGA O?ETA.;15 Pe?nik,258 Sanja;;Matija Rupel,Nina Rakovec;1 1/2
54;54-25;Lj/Bb-Jeva Pisarna;DAN-INT.;BB IZVE ZA SANJIN NO?NI OBISK PRI EDVARDU.;19 Bb,250 Operativec;;Valter Dragan,Damjan M. Trbovc; 7/8
55;55-01;Lj/Nadino stanovanje/Jedilnica;DAN-INT.; JANA ZAVRNE MARKOV DENAR - SE JE ŽE ODLO?ILA ZA PRODAJO STANOVANJA.;1 Mark,12 Jana;;Matej Zemlji?,Tanja Poto?nik;1 3/8
55;55-02;Lj/Dolen?evo Stanovanje/Dnevna Soba;DAN-INT.; SANJA IZ PE?NIKA IZVLE?E PRIZNANJE  DA MU JE BB NARO?IL UMOR NJENEGA O?ETA. ;15 Pe?nik,258 Sanja;;Matija Rupel,Nina Rakovec;1 1/2
55;55-03;Lj/Nadino Stanovanje/Dnevni Del;DAN-INT.; LARA OD JANE IZVE ZA MARKOVO PONUJENO FINAN?NO POMO?.;2 Lara,12 Jana;;Gaja Fila?,Tanja Poto?nik;2 1/2
55;55-04;Lj/Markova Garsonjera/Dnevni Del;DAN-INT.; MIA BI BILA RADA Z ŽANOM  A NE ZMORE PUSTITI MARKA.;21 Mia,253 Žan;;Zala Djuri?,Domen Novak;1 1/8
55;55-05;Lj/Dolen?evo Stanovanje/Dnevna Soba;DAN-INT.; SANJA JE VSE BLIŽE ZADNJEMU KOŠ?KU V MOZAIKU DOKAZOV PROTI BB-JU. NJEN POBEG S PE?NIKOM NA SRE?O PREKINE JANIN KLIC.;15 Pe?nik,258 Sanja;;Matija Rupel,Nina Rakovec;2 1/8
55;55-06;Lj/Nadino Stanovanje/Dnevni Del;DAN-INT.; JANA SE S SANJO DOGOVORI ZA OGLED STANOVANJA S PRVIM KUPCEM. PRESENETI JO HRVOJE Z REŠITVIJO  KAKO OBDRŽATI STANOVANJE.;14 Hrvoje,12 Jana;;Alen Šalinovi?,Tanja Poto?nik;1 1/4
55;55-07;Lj/Steinerjeva Klinika/Pisarna/Ordinacija;DAN-INT.; LARA IZ MARKA IZVLE?E  DA JE DENAR  KI GA JE PONUJAL JANI  DENAR Z RAZPISA ZA NJEGOV DOBRODELNI PROJEKT.;2 Lara,1 Mark,257 Dr. Mirt;;Gaja Fila?,Matej Zemlji?,Žiga Udir;1 5/8
55;55-08;Lj/Nadino Stanovanje/Dnevni Del;DAN-INT.; HRVOJE JANI IZRO?I DENAR OD PRODANEGA AVTODOMA  A TO NI DOVOLJ  DA BI REŠILO JANINO STANOVANJE.;14 Hrvoje,12 Jana;;Alen Šalinovi?,Tanja Poto?nik;3 3/8
55;55-09;Lj/Dolen?evo Stanovanje/Dnevna Soba;DAN-INT.; SANJA IN PE?NIK MORATA IZ STANOVANJA - DOGOVORITA SE NA DOLO?ENEM KRAJU  OD KODER BOSTA SKUPAJ POBEGNILA IZ DRŽAVE.;15 Pe?nik,258 Sanja;;Matija Rupel,Nina Rakovec;2
55;55-10;Lj/Steinerjeva Klinika/Pisarna/Ordinacija;DAN-INT.; LARA JE HVALEŽNA ZA MARKOV POSKUS DAROVANJA  A TEGA DENARJA Z MAMO RES NE MORETA SPREJETI.;2 Lara,1 Mark;;Gaja Fila?,Matej Zemlji?;1 3/4
55;55-11;Lj/Markova Garsonjera/Dnevni Del;DAN-INT.; MIA BI RADA CELOTEN ZAPLET Z ŽANOM PREKINILA IN POZABILA  HO?E DA JO ŽAN PUSTI SAMO.;21 Mia,253 Žan;;Zala Djuri?,Domen Novak;2
55;55-12;Lj/Edvardovo Stanovanje/Dnevna Soba;DAN-INT.;SANJA IN EDI NA POSNETKU DOBITA POTRDITEV  DA JE BB RES PE?NIKU NARO?IL UMOR STANETA.;3 Edvard,19OFF Bb Off,258 Sanja,15OFF Pe?nik Off;;Aleš Vali?,Valter Dragan,Nina Rakovec,Matija Rupel;2
55;55-13;Lj/Pe?nikova Pisarna;DAN-INT.; SANJA SE Z LAŽJO IZVLE?E IZ BB-JEVE OBTOŽBE  DA SODELUJE Z EDVARDOM  IN MU PREDA INFORMACIJO  KJE NAJDE PE?NIKA.;19 Bb,258 Sanja;;Valter Dragan,Nina Rakovec;2
55;55-14;Lj/Kova?eva Mesnica;DAN-INT.;"PARALELNI SEKVENCI (TELEFONSKI POGOVOR) FRENK HRVOJU NARO?A CELO PALETO MESNIH DOBROT ZA ""DOSTAVO"" V KEMP  IN IZVE  DA MESNICA NI V DOBREM STANJU.";14 Hrvoje,7PS Frenk PS;;Alen Šalinovi?,Gaber Trseglav;1 3/8
55;55-15;Kemp/Kova?eva Parcela/Pred Prikolico;DAN-EXT.;"PARALELNI SEKVENCI  FRENK HRVOJU NARO?A CELO PALETO MESNIH DOBROT ZA ""DOSTAVO""  V KEMP  IN IZVE  DA MESNICA NI V DOBREM STANJU.";7 Frenk,6 Meri,14PS Hrvoje PS;;Gaber Trseglav,Vesna Pernar?i?,Alen Šalinovi?;1 1/4
55;55-16;Lj/Dolen?evo Stanovanje/Dnevna Soba;DAN-INT.;LARA IN JANA OBUJATA SPOMINE NA DRUŽINSKO ŽIVLJENJE V STANOVANJE  KAMOR PRIHAJA KUPEC.;2 Lara,12 Jana,372 Kupec 2;;Gaja Fila?,Tanja Poto?nik,Gašper Zaviršek;1 3/4
55;55-17;Lj/Pe?nikova Pisarna;DAN-INT.; BB SANJI IZPLA?A NAGRADO ZA PE?NIKA  NATO PA IZVE  DA MU JE SANJA LAGALA - NARO?ILA JE OBDUKCIJO O?ETA.;19 Bb,258 Sanja,370 Predstojnica;;Valter Dragan,Nina Rakovec,Andreja Škrabec;2 7/8
55;55-18;Kemp/Kova?eva Parcela/Pred Prikolico;DAN-EXT.; MERI DOBI IDEJO  KAKO Z MORJA VODITI POSLE V LJUBLJANI.;7 Frenk,6 Meri;;Gaber Trseglav,Vesna Pernar?i?;1 3/8
55;55-19;Lj/Pasaža/Pred mesnico;DAN-INT.; NINA POVABI HRVOJA NA PIJA?O.;14 Hrvoje,18 Nina,303 STATISTI PASAŽA A 3x 14.4.;STATISTI PASAŽA A 3x 14.4.;Alen Šalinovi?,Melani Mekicar;1 3/8
55;55-20;Lj/Dolen?evo Stanovanje/Dnevna Soba;DAN-INT.; JANA JE TIK PRED PODPISOM POGODBE ZA STANOVANJE  KO JO PREKINE KLIC Z BANKE.;2 Lara,12 Jana,372 Kupec 2;;Gaja Fila?,Tanja Poto?nik,Gašper Zaviršek;1 7/8
55;55-21;Lj/Edvardovo Stanovanje/Dnevna Soba;DAN-INT.;BB IN EDVARD NA MIZO VRŽETA DOKAZE  KI JIH IMATA DRUG PROTI DRUGEMU. BB JE STISNJEN V KOT.;3 Edvard,19 Bb;;Aleš Vali?,Valter Dragan;1 3/4
55;55-22;Lj/Pasaža/Lokal;DAN-INT.; HRVOJE - VNOVI? RAZO?ARAN - VNOVI? UTAPLJA ŽALOST V ALKOHOLU.;14 Hrvoje,18 Nina,303 STATISTI PASAŽA A 3x 14.4.,304 STATIST LOKAL B 1x 14.4.;STATISTI PASAŽA A 3x 14.4.,STATIST LOKAL B 1x 14.4.;Alen Šalinovi?,Melani Mekicar;1 1/2
55;55-23;Kemp/Ex-Renatova Parcela;DAN-EXT.;MERI IMA ZA DINA IN SAŠKO SUPER PREDLOG - DA PREVZAMETA POSLE KOVA?EVIH V LJUBLJANI.;4 Dino,5 Saška,6 Meri,1000 Vozi?ek;;Matino Antunovi?,Mila Peršin,Vesna Pernar?i?;1 1/4
55;55-24;Lj/Dolen?evo Stanovanje/Dnevna Soba;DAN-INT.; JANA IZVE  DA JE NEKDO POPLA?AL CELOTEN KREDIT.;2 Lara,12 Jana,372 Kupec 2;;Gaja Fila?,Tanja Poto?nik,Gašper Zaviršek;1
55;55-25;Lj/Markova Garsonjera/Spalni Del;DAN-INT.;ŽAN JE PREGOVORIL MIO - KON?ALA STA V POSTELJI IN ... TAM JU NAJDE MARK.;1 Mark,21 Mia,253 Žan;;Matej Zemlji?,Zala Djuri?,Domen Novak; 1/4
55;55-26;Lj/Bb-Jeva Pisarna;DAN-INT.; BB MORA UKREPATI PROTI EDIJU - ZA OPERATIVCA IMA URGENTNO NALOGO.;19 Bb,250 Operativec;;Valter Dragan,Damjan M. Trbovc; 5/8
56;1;;DAN-INT.;;;;;0
56;1;;DAN-INT.;;;;;0
56;56-01;Lj/Markova Garsonjera/Spalni Del;DAN-INT.;MARKU NI DO NOVEGA PREPIRA - MIO IN ŽANA NAŽENE IZ SVOJE GARSONJERE.;1 Mark,21 Mia,253 Žan;;Matej Zemlji?,Zala Djuri?,Domen Novak;1 3/8
56;56-02;Lj/Dolen?evo Stanovanje/Dnevna Soba;DAN-INT.;JANI NE BO TREBA PRODATI STANOVANJA ZARADI SKRIVNOSTNEGA DOBROTNIKA  KI JE POPLA?AL NJEN KREDIT.;2 Lara,12 Jana,372 Kupec 2;;Gaja Fila?,Tanja Poto?nik,Gašper Zaviršek;1 3/4
56;56-03;Kemp/Ex-Renatova Parcela;DAN-EXT.; DINO JE PROTI MERIJINEMU PREDLOGU  DA BI S SAŠKO PREVZELA POSLE V LJUBLJANI. A MERI SE ŠE NE PREDAJA.;4 Dino,5 Saška,6 Meri,1000 Vozi?ek;;Matino Antunovi?,Mila Peršin,Vesna Pernar?i?;2 5/8
56;56-04;Lj/Pasaža/Lokal;DAN-INT.;NINA PREPRI?UJE HRVOJA  DA NE BO MOGEL VOZIT NAZAJ V KEMP  ?E BO PREVE? SPIL  A HRVOJE SE NE DA.;14 Hrvoje,18 Nina,303 STATISTI PASAŽA A 3x 14.4.,304 STATIST LOKAL B 1x 14.4.;STATISTI PASAŽA A 3x 14.4.,STATIST LOKAL B 1x 14.4.;Alen Šalinovi?,Melani Mekicar;1 7/8
56;56-05;Lj/Steinerjeva Klinika/Sprejemnica;DAN-INT.;OPERATIVEC LARI IZRO?I NUJEN PAKET ZA EDVARDA.;2 Lara,250 Operativec;;Gaja Fila?,Damjan M. Trbovc; 5/8
56;56-05A;Lj/Steinerjeva Klinika/Sprejemnica;DAN-INT.;POSNETI  POGLED VARNOSTNE KAMERE ZA 67-21 - lara prejema paket;2 Lara,250 Operativec;;Gaja Fila?,Damjan M. Trbovc; 5/8
56;56-06;Kemp/Recepcija;DAN-INT.; SAŠKA PODPIRA DINA - NE GRESTA V LJUBLJANO. OSTALA BOSTA V KEMPU;4 Dino,5 Saška,1000 Vozi?ek;;Matino Antunovi?,Mila Peršin;2 1/2
56;56-07;Lj/Steinerjeva Klinika/Sprejemnica;DAN-INT.;LARA JE ODLO?ENA  DA BO PAKET OSEBNO DOSTAVILA EDIJU  ?EPRAV DR. MIRT NJENI USLUŽNOSTI NASPROTUJE.;2 Lara,257 Dr. Mirt;;Gaja Fila?,Žiga Udir;2 7/8
56;56-08;Lj/Pasaža/Lokal;DAN-INT.;NINA HRVOJA LE ODREŽE OD PIJA?E. HRVOJE OBLJUBI  DA SE BO STREZNIL  PREDEN SEDE V AVTO.;14 Hrvoje,18 Nina,303 STATISTI PASAŽA A 3x 14.4.,304 STATIST LOKAL B 1x 14.4.;STATISTI PASAŽA A 3x 14.4.,STATIST LOKAL B 1x 14.4.;Alen Šalinovi?,Melani Mekicar;1
56;56-09;Lj/Steinerjeva Klinika/Pisarna/Ordinacija;DAN-INT.;MIA IMA SLABO VEST - BOJI SE  DA JE MARKA PREHUDO PRIZADELA.;21 Mia,253 Žan;;Zala Djuri?,Domen Novak;2 7/8
56;56-10;Lj/Markova Garsonjera/Spalni Del;DAN-INT.;MARK IMA DOVOLJ.;1 Mark;;Matej Zemlji?; 3/8
56;56-11;Lj/Dolen?evo Stanovanje/Dnevna Soba;DAN-INT.;EDVARD OPOZORI SANJO  DA BB NE POPUŠ?A  IN JI SVETUJE  NAJ SE TAKOJ UMAKNE NAZAJ V AMERIKO.;3 Edvard,258 Sanja;;Aleš Vali?,Nina Rakovec;2 3/8
56;56-12;Kemp/Kova?eva Parcela/Pred Prikolico;DAN-EXT.;MERI IN FRENK POSTAJATA NERVOZNA  KER HRVOJE ZAMUJA S POŠILJKO MESNIN IZ LJUBLJANE.;7 Frenk,6 Meri,206 KEMP STANDARD (7);KEMP STANDARD (7);Gaber Trseglav,Vesna Pernar?i?;1 5/8
56;56-13;Lj/Pasaža/Lokal;DAN-INT.;HRVOJE NI DRŽAL SVOJE OBLJUBE - OD PIJA?E JE ZASPAL NA MIZI.;14 Hrvoje,23 Borut,303 STATISTI PASAŽA A 3x 14.4.,304 STATIST LOKAL B 1x 14.4.;STATISTI PASAŽA A 3x 14.4.,STATIST LOKAL B 1x 14.4.;Alen Šalinovi?,Miha Rodman; 5/8
56;56-14;Lj/Edvardovo Stanovanje/Dnevna Soba;DAN-INT.;LARA IŠ?E EDVARDA  DA BI MU DOSTAVILA PAKET  A EDIJA NI DOMA.;2OFF Lara Off;;Gaja Fila?; 5/8
56;56-15;Lj/Vila/Vhodna Veža s Stopniš?em;DAN-INT.;LARA ŽE OBUPA  KO SE LE POJAVI EDI  IN MU IZRO?I PAKET.;2 Lara,3 Edvard;;Gaja Fila?,Aleš Vali?;1 3/8
56;56-16;Lj/Nadino stanovanje/Ordinacija;DAN-INT.; NADA JE ODLO?ENA  DA SE JE NJEN ODNOS Z DAVIDOM KON?AL ŠE PRED BI SE ZARES ZA?EL.;12 Jana,13 Nada;;Tanja Poto?nik,Aleksandra Balmazovi?;3
56;56-17;Lj/Markova Garsonjera/Dnevni Del;DAN-INT.;LARA SE PRIDE MARKU ZAHVALIT ZA VELIKO GESTO - POPLA?ILO KREDITA - IN MU OBLJUBI  DA MU BOSTA Z JANO V CELOTI VRNILI.;2 Lara,1 Mark;;Gaja Fila?,Matej Zemlji?;2 3/4
56;56-18;Kemp/Recepcija;DAN-INT.;FRENK SE JEZI NAD HRVOJEM  KI ZAMUJA  A SE TUDI DINU NE JAVLJA NA TELEFON.;7 Frenk,4 Dino;;Gaber Trseglav,Matino Antunovi?;2 1/4
56;56-19;Lj/Edvardovo Stanovanje/Dnevna Soba;DAN-INT.;"EDVARD JE SKEPTI?EN DO PAKETA. PREPRI?A GA SMS ""IZ BRUSLJA"".";3 Edvard;;Aleš Vali?; 1/2
56;56-20;Lj/Nadino stanovanje/Ordinacija;DAN-INT.; DAVID HO?E OD NADE POJASNILA - ZAKAJ IGNORIRA NJEGOVE KLICE?;12 Jana,11 David,13 Nada;;Tanja Poto?nik,Blaž Vali?,Aleksandra Balmazovi?; 7/8
56;56-21;Kemp/Pred recepcijo;DAN-EXT.;NINA PRIPELJE PIJANEGA HRVOJA V KEMP.;14 Hrvoje,7 Frenk,18 Nina,4 Dino;;Alen Šalinovi?,Gaber Trseglav,Melani Mekicar,Matino Antunovi?;1
56;56-22;Lj/Pasaža/Lokal;DAN-INT.;BORUT NAJDE HLADILNO TORBO  POLNO MESNIN  KI JO JE HRVOJE POZABIL.;23 Borut,305 STATISTI PASAŽA C 3x 14.4.;STATISTI PASAŽA C 3x 14.4.;Miha Rodman; 1/4
56;56-23;Lj/Markova Garsonjera/Dnevni Del;DAN-INT.;MIA SE PRIDE POGOVORIT Z MARKOM  A MARK ŽE IZPOVEDUJE SVOJO LJUBEZEN LARI.;2 Lara,1 Mark,21 Mia;;Gaja Fila?,Matej Zemlji?,Zala Djuri?;2 3/8
56;56-24;Lj/Edvardovo Stanovanje/Dnevna Soba;DAN-INT.;EDVARDA NAPADEJO PRVI SIPTOMI ZASTRUPITVE - NE USPE PRIKLICATI POMO?I IN NEMO?EN OBLEŽI.;3 Edvard;;Aleš Vali?; 3/8
56;56-25;Lj/Bb-Jeva Pisarna;DAN-INT.;BB JE NA MISIJI - PAKET ZA EDIJA JE BIL SAMO PRVI. LOTIL SE JE PRAVE ?ISTKE.;19 Bb,250 Operativec;;Valter Dragan,Damjan M. Trbovc; 3/4
57;1;;DAN-INT.;;;;;0
57;57-01;Lj/Markova Garsonjera/Dnevni Del;DAN-INT.;LARI JE ŽAL ZA MARKA  A NE MORE PREKO TEGA  DA JI JE ODGOVOREN ZA SMRT O?ETA. LARA NIKOLI NE BO Z MARKOM.;2 Lara,1 Mark,21 Mia;;Gaja Fila?,Matej Zemlji?,Zala Djuri?;1 1/4
57;57-02;Lj/Nadino stanovanje/Ordinacija;DAN-INT.; NADA DAVIDU POVE ZA JULIJINO LAŽ. DAVID ZANIKA  DA JE SPET Z JULIJO.;11 David,13 Nada;;Blaž Vali?,Aleksandra Balmazovi?;1 1/2
57;57-03;Kemp/Recepcija;DAN-INT.; NINA SE NIMA NAMENA VRNIT V LJUBLJANO. DINO JI PONUDI PRENO?IŠ?E V KEMPU. ;18 Nina,4 Dino;;Melani Mekicar,Matino Antunovi?;2 3/8
57;57-04;Kemp/Kova?eva Parcela/Pred Prikolico;DAN-EXT.;SAŠKA IZVE  DA JE NINA V KEMPU.;7 Frenk,5 Saška,6 Meri,206 KEMP STANDARD (7);KEMP STANDARD (7);Gaber Trseglav,Mila Peršin,Vesna Pernar?i?;2 1/8
57;57-05;Lj/Nadino stanovanje/Ordinacija;DAN-INT.; DAVID PRISEŽE NADI  DA JE ZAKLJU?IL Z JULIJO IN DA SI ŽELI BITI Z NADO.  ;11 David,13 Nada;;Blaž Vali?,Aleksandra Balmazovi?;2 1/8
57;57-06;Lj/Lokacija/Operativ?ev Avto;DAN-EXT;OPERATIVEC JE S SMRTONOSNIM PAKETOM NA POTI K JULIJI  KO DOBI BB-JEV KLIC.;250 Operativec;;Damjan M. Trbovc; 3/8
57;57-07;Lj/Markova Garsonjera/Dnevni Del;DAN-INT.;MARK MED PAKIRANJEM NAJDE MAJICO  KI MU JO JE PODARILA LARA.;1 Mark;;Matej Zemlji?; 5/8
57;57-08;Lj/Steinerjeva Klinika/Sprejemnica;DAN-INT.;LARA NAPIŠE ODPOVED  A NO?E POVEDATI LEONU RAZLOGA  ZAKAJ NE MORE VE? DELATI NA KLINIKI.;2 Lara,257 Dr. Mirt;;Gaja Fila?,Žiga Udir;1 5/8
57;57-09;Lj/Bb-Jeva Pisarna;DAN-INT.; BB USTAVI OPERATIVCA. VENDARLE SE NE MORE PRIPRAVITI DO TEGA  DA BI VZEL ŽIVLJENJE JULIJI. ;19 Bb;;Valter Dragan; 3/4
57;57-10;Lj/Bistro Lotus/Šank;DAN-INT.; SANJA ZA ŠANKOM POSKUŠA POZABITI NA EDVARDOVA OPOZORILA  A NO?I VENDARLE NE ŽELI PREŽIVETI V SVOJEM STANOVANJU. ;258 Sanja,202 Natakar,209 STATISTI LOTUS A 6x 9.4.,367 Natakar;Natakar,STATISTI LOTUS A 6x 9.4.;Nina Rakovec,Dario Noži? Serini Dacho;1 5/8
57;57-11;Kemp/Parcela Med Borovci;DAN-EXT.;DINO IN NINA PRI?AKUJETA SAŠKIN LJUBOSUMNI IZBRUH. SAŠKA NIMA TEŽAV S TEM  DA NINA OSTANE KAKŠEN DAN V KEMPU.;18 Nina,4 Dino,5 Saška,206 KEMP STANDARD (7);KEMP STANDARD (7);Melani Mekicar,Matino Antunovi?,Mila Peršin;4
57;57-12;Lj/Nadino Stanovanje/Spalnica;DAN-INT.;NADA IN DAVID STA PRISTALA V POSTELJI. DAVID BI SE POGOVORIL  KAKO NAPREJ. NADA ŽELI LE UŽIVATI V TRENUTKU.;11 David,13 Nada;;Blaž Vali?,Aleksandra Balmazovi?;1 3/4
57;57-13;Lj/Markova Garsonjera/Dnevni Del;DAN-INT.;MARKA ZJUTRAJ ZBUDI MIA  KI JE PRIŠLA PO SVOJE STVARI. MARK SE JI UMAKNE.;1 Mark,21 Mia;;Matej Zemlji?,Zala Djuri?;1 5/8
57;57-14;Kemp/Ex Renatova Parcela/Prikolica;DAN-INT./EXT.;DINO JE VESEL  DA SAŠKA NI VE? LJUBOSUMNA NA NINO IN DA GA PODPIRA PRI ODLO?ITVI  DA SE NE VRNETA V LJUBLJANO.;4 Dino,5 Saška,206 KEMP STANDARD (7),1000 Vozi?ek;KEMP STANDARD (7);Matino Antunovi?,Mila Peršin;1 7/8
57;57-15;Lj/Nadino Stanovanje/Spalnica;DAN-INT.; DAVID ŽELI BITI Z NADO. NE BO DOPUSTIL  DA JULIJA STOJI NA POTI NJUNI SRE?I. ;11 David,13 Nada;;Blaž Vali?,Aleksandra Balmazovi?;1 1/2
57;57-16;Lj/Markova Garsonjera/Dnevni Del;DAN-INT.; MIA SE OPRAVI?I MARKU ZA PREVARO IN MU ŽELI VSO SRE?O Z LARO. MARK ODPUSTI MII. ISKRENO UPA  DA BO SRE?NA Z ŽANOM.;1 Mark,21 Mia;;Matej Zemlji?,Zala Djuri?;2 1/4
57;57-17;Lj/Steinerjeva Klinika/Sprejemnica;DAN-INT.; LARA VENDARLE POVE LEONU  DA NE MORE VE? DELATI NA KLINIKI ZARADI MARKA  KI JE ŠE VEDNO ZALJUBLJEN VANJO.;2 Lara,257 Dr. Mirt;;Gaja Fila?,Žiga Udir;1 1/4
57;57-18;Lj/Markova Garsonjera/Dnevni Del;DAN-INT.;JULIJA POSKUŠA PREGOVORITI MARKA  NAJ SE NE ODSELI OD DOMA.;1 Mark,10 Julija;;Matej Zemlji?,Sabina Kogovšek;1 7/8
57;57-19;Kemp/Kova?eva Parcela/Pred Prikolico;DAN-EXT.; MERI JE SLABE VOLJE  KER SAŠKA IN DINO NE ŽELITA PREVZETI POSLOV V LJUBLJANI. A NE MISLI KAR TAKO ODNEHAT. ;7 Frenk,6 Meri,206 KEMP STANDARD (7);KEMP STANDARD (7);Gaber Trseglav,Vesna Pernar?i?;2 1/8
57;57-20;Kemp/Restavracija;DAN-INT.; DINO IZVE  DA JE NINO ZAPUSTIL FANT. JI PONUDI DELO V KEMPU.   ZMOTITA JU MERI IN FRENK  KI STA PRIŠLA NA ZAJTRK.;7 Frenk,18 Nina,4 Dino,6 Meri,254 še gost restavracije (poleg italijansko govore?e gostje),386 Gostja restavracije - italijansko govore?a;še gost restavracije (poleg italijansko govore?e gostje);Gaber Trseglav,Melani Mekicar,Matino Antunovi?,Vesna Pernar?i?;3
57;57-21;Lj/Julijino Stanovanje/Jedilnica;DAN-INT.; DAVID SOO?I JULIJO Z NJENO LAŽJO NADI IN JI POVE  DA JE OPRAVIL Z NJO. ;10 Julija,11 David;;Sabina Kogovšek,Blaž Vali?;2
57;57-22;Lj/Steinerjeva Klinika/Sprejemnica;DAN-INT.; LEON PREDLAGA LARI  DA SE ?IMPREJ VRNE V AVSTRALIJO. ON BI ŠEL PA Z NJO. ;2 Lara,257 Dr. Mirt;;Gaja Fila?,Žiga Udir;1 7/8
57;57-23;Lj/Vila/Vhodna Veža s Stopniš?em;DAN-INT.; MARK ZAPUŠ?A VILO. A NE MORE ODIT  NE DA BI SE POSLOVIL OD EDVARDA. ;1 Mark;;Matej Zemlji?; 1/2
57;57-24;Lj/Edvardovo Stanovanje/Dnevna Soba;DAN-INT.;MARK NAJDE EDVARDA V PREDSMRTNIH KR?IH.;1 Mark,3 Edvard;;Matej Zemlji?,Aleš Vali?; 3/4
57;57-25;Lj/Dolen?evo Stanovanje/Dnevna Soba;DAN-INT.; SANJA SE PO PREŽURANI NO?I VRNE DOMOV IN NAJDE PAKET. ;258 Sanja;;Nina Rakovec; 3/8
58;58-01;Lj/Edvardovo Stanovanje/Dnevna Soba;DAN-INT.;REŠEVALCI ODPELJEJO EDVARDA  KI JE V KRITI?NEM STANJU - LAHKO DA SE NE BO IZVLEKEL.;1 Mark,3 Edvard,10 Julija,398 Reševalec 1,399 Reševalec 2;;Matej Zemlji?,Aleš Vali?,Sabina Kogovšek,Aljoša Milan Šibelja,David Logar;1
58;58-02;Lj/Dolen?evo Stanovanje/Kabinet;DAN-INT.;SANJA JE ŽE NA TEM  DA ODPRE SMRTONOSNI PAKET  KO JO PREKINE ZVONEC.;258 Sanja;;Nina Rakovec; 3/8
