Epizoda;Prizor;Lokacija;Okoliš?ine;Opis;Liki;Statisti;Igralci;Število strani scenarija
1;01-Jan;Kemp/Plaža;DAN-EXT.;Prazna plaža  na njej dve brisa?i  ena poleg druge. Dan je son?en in po?asen. Vse se dogaja v zamaknjeni morski idili. Gledamo od strani kot bi nekdo opazoval romantiko od dale?. Iz vode se sliši smeh in veseli ženski vzkliki. Ne vidimo kdo je v vodi  slišijo se samo glasovi.;2OFF Lara Off,1OFF Mark Off;;Gaja Fila?,Matej Zemlji?; 3/8
1;01-Feb;Kemp/Plaža/V Vodi;DAN-EXT.;ROMANTI?NA LJUBEZENSKA IDILA MED MARKOM IN LARO SE SPREVRŽE V MORO.;2 Lara,1 Mark;;Gaja Fila?,Matej Zemlji?;1 3/4
1;01-Mar;Lj/Markova Garsonjera/Spalni Del;DAN-INT.;MARK SE ZBUDI IZ NO?NE MORE. MIO SKRBI  DA BO MARK MORAL V ZAPOR.;1 Mark,21 Mia;;Matej Zemlji?,Zala Djuri?;1 1/2
1;01-Apr;Kemp/Edvardova parcela/Pred prikolico;DAN-EXT;HRVOJE BODRI EDVARDA  KI GA SKRBI MARKOVA ZAKLJU?NA OBRAVNAVA.;14 Hrvoje,3 Edvard,203 KEMP VE? (15);KEMP VE? (15);Alen Šalinovi?,Aleš Vali?;1 1/2
1;01-May;Lj/Bistro Lotus;DAN-INT.;JULIJA S SVOJIM ŠARMOM IN S SVOJO POSLOVNO PRETKANOSTJO O?ARA POSLOVNEŽA IN SVOJEGA ŠEFA ROMANA.;10 Julija,251 Roman,300 Poslovnež Andrej,411 Natakarica,300 STATISTI LOTUS A 6x 10.4.,301 STATISTI LOTUS 3x 10.4.;STATISTI LOTUS A 6x 10.4.,STATISTI LOTUS 3x 10.4.;Sabina Kogovšek,Uroš Smolej,Robert Gazvoda,Ksenija Žuni?;2
1;01-Jun;Hr/Pred Sodiš?em;DAN-EXT.;MARK PRED SODIŠ?EM SRE?A JANO IN SE JI OPRAVI?I. JANA MU OBRNE HRBET  NE ŽELI SPREJETI NJEGOVEGA OPRAVI?ILA.;1 Mark,21 Mia,12 Jana,194 ?rt,291 Policaj  EXT. 1x;Policaj  EXT. 1x;Matej Zemlji?,Zala Djuri?,Tanja Poto?nik,Aljaž Tepina;1 1/2
1;01-Jul;Lj/Bb-Jeva Pisarna;DAN-INT.; BB IZVE  DA MINISTRSTVO NE BO FINANCIRALO KONGRESA. NA STANETA BO ZDAJ PRITISNIL PO DRUGIH ZVEZAH.;19 Bb,15 Pe?nik;;Valter Dragan,Matija Rupel;1 3/4
1;01-Aug;Lj/Bistro Lotus;DAN-INT.;JULIJA JE ZRIHTALA BIZNIS. ROMANU DA VEDETI  KAKO NEPOGREŠJIVA JE ZA NJEGOVO FIRMO.;10 Julija,251 Roman,300 Poslovnež Andrej,411 Natakarica,300 STATISTI LOTUS A 6x 10.4.,301 STATISTI LOTUS 3x 10.4.;STATISTI LOTUS A 6x 10.4.,STATISTI LOTUS 3x 10.4.;Sabina Kogovšek,Uroš Smolej,Robert Gazvoda,Ksenija Žuni?;2
1;01-Sep;Hr/Sodna Dvorana;DAN-INT.;OBRAVNAVA SE ZA?ENJA. JANA POGREŠA LARO. IMA SLABO VEST  KER JI NI POVEDALA ZA ZAKLJU?NO OBRAVNAVO.;1 Mark,21 Mia,3 Edvard,12 Jana,194 ?rt,302 Sodnica,301 Odvetnica,303 Tožilec,304 Zapisnikarica,292 POLICISTA INT. 2x;POLICISTA INT. 2x;Matej Zemlji?,Zala Djuri?,Aleš Vali?,Tanja Poto?nik,Aljaž Tepina;1 1/2
1;01-Oct;Lj/Julijino Stanovanje/Dnevna Soba;DAN-INT.;DAVID JE PRIŠEL PO ELO. DAVID SE ?UDI  DA JULIJA NITI OMENI NE MARKA IN NJEGOVE OBRAVNAVE.;10 Julija,16 Ela,11 David;;Sabina Kogovšek,Mei Rabi?,Blaž Vali?;2 7/8
1;01-Nov;Lj/Bb-Jeva Pisarna;DAN-INT.; BB UGOTOVI  DA GA JE STANE BLOKIRAL NA VSEH KANALIH. PE?NIK PREDLAGA  DA BI MINISTER LAHKO IMEL “NESRE?O”...;19 Bb,15 Pe?nik;;Valter Dragan,Matija Rupel;1 1/2
1;01-Dec;Kemp/Pot ?ez Kemp;DAN-EXT.; MINISTER STANE ODHAJA NA RIBOLOV  FRENK PA POVABI FANTE NA BALINANJE. A IZVE  DA JE EDVARD NA OBRAVNAVI. ;14 Hrvoje,161 Stane,7 Frenk,203 KEMP VE? (15);KEMP VE? (15);Alen Šalinovi?,Bojan Maroševi?,Gaber Trseglav;1 3/4
1;Jan-13;Hr/Sodna Dvorana;DAN-INT;ODVETNICA V ZAKLJU?NEM GOVORU POUDARI DEJSTVA  KI GOVORIJO V MARKOV PRID. MARK PA V DVORANI ZAGLEDA - LARO!;2 Lara,1 Mark,21 Mia,3 Edvard,12 Jana,194 ?rt,302 Sodnica,301 Odvetnica,303 Tožilec,304 Zapisnikarica,292 POLICISTA INT. 2x;POLICISTA INT. 2x;Gaja Fila?,Matej Zemlji?,Zala Djuri?,Aleš Vali?,Tanja Poto?nik,Aljaž Tepina;1 3/8
1;Jan-14;Lj/Julijino Stanovanje/Dnevna Soba;DAN-INT.;JULIJA RAZLOŽI DAVIDU  KAJ SI MISLI O MARKOVI OBRAVNAVI IN  ZAKAJ JE NI TAM.;10 Julija,11 David,16OFF Ela Off;;Sabina Kogovšek,Blaž Vali?,Mei Rabi?;2
1;Jan-15;Kemp/Pot ?ez Kemp;DAN-EXT.;MOŠKI RAZPRAVLJAJO O USODNI NESRE?I. IN O USODNIH LJUBEZNIH. FRENK NE ŽELI GOVORITI O MERI  STANE PA ODIDE NA RIBOLOV.;14 Hrvoje,161 Stane,7 Frenk,203 KEMP VE? (15);KEMP VE? (15);Alen Šalinovi?,Bojan Maroševi?,Gaber Trseglav;2 1/2
1;Jan-16;Lj/Bb-Jeva Pisarna;DAN-INT.; PE?NIK PONOVNO PREDLAGA AKCIJO PROTI MINISTRU. BB ODIDE IN PUSTI PE?NIKA BREZ ODGOVORA. ;19 Bb,15 Pe?nik;;Valter Dragan,Matija Rupel; 7/8
1;Jan-17;Hr/Sodna Dvorana;DAN-INT;SODNICA RAZGLASI SVOJO ODLO?ITEV - MARK NI KRIV. MARKOVI NAJBLIŽJI SE VESELIJO  LARA PA IZGINE.;2 Lara,1 Mark,21 Mia,3 Edvard,12 Jana,194 ?rt,302 Sodnica,301 Odvetnica,303 Tožilec,304 Zapisnikarica,292 POLICISTA INT. 2x;POLICISTA INT. 2x;Gaja Fila?,Matej Zemlji?,Zala Djuri?,Aleš Vali?,Tanja Poto?nik,Aljaž Tepina;1
1;Jan-18;Lj/Julijino Stanovanje/Kuhinja;DAN-INT.;JULIJA PREJME MIIN KLIC  MIA JI POVE  DA JE MARK OPROŠ?EN.;10 Julija,21OFF Mia Off;;Sabina Kogovšek,Zala Djuri?;1 3/8
1;Jan-19;Hr/Sodna Dvorana;DAN-INT;JANA JE PO ZAKLJU?KU OBRAVNAVE POTRTA. ?RT PA DOBI DOBRO NOVICO.;12 Jana,194 ?rt,292 POLICISTA INT. 2x;POLICISTA INT. 2x;Tanja Poto?nik,Aljaž Tepina;1 1/8
1;Jan-20;Hr/Pred Sodiš?em;DAN-EXT.;MARK ZAGLEDA LARO  KI O?ITNO LE NI BILA SAMO PRIKAZEN;2 Lara,1 Mark,291 Policaj  EXT. 1x;Policaj  EXT. 1x;Gaja Fila?,Matej Zemlji?; 5/8
1;Jan-21;Lj/Pe?nikova Pisarna;DAN-INT.;"PE?NIK SE DOBI Z ""OPERATIVCEM"" IN GA NA LASTNO PEST POŠLJE V AKCIJO.";15 Pe?nik,250 Operativec;;Matija Rupel,Damjan M. Trbovc;1 5/8
1;Jan-22;Hr/Sodna Dvorana;DAN-INT.;?RT ŽELI  DA JANA ZAKLJU?I STARO ZGODBO IN SE FOKUSIRA NA NJUNO PRIHODNOST.;12 Jana,194 ?rt,292 POLICISTA INT. 2x;POLICISTA INT. 2x;Tanja Poto?nik,Aljaž Tepina;2
1;Jan-23;Hr/Pred Sodiš?em;DAN-EXT.;LARIN OBRA?UN Z MARKOM.;2 Lara,1 Mark,21 Mia,291 Policaj  EXT. 1x;Policaj  EXT. 1x;Gaja Fila?,Matej Zemlji?,Zala Djuri?;2 1/4
1;Jan-24;Lj/Pasaža/Lokal;DAN-INT.;LARA SPORO?I NINI  DA JE MARK OPROŠ?EN.LARA MORA STAT JANI OB STRANI  DO NINE PA PRIDE DINO.;18 Nina,4 Dino,2V Lara Videoklic,227 LOKAL A 3x 19.2.,228 LOKAL AA 4x 19.2.;LOKAL A 3x 19.2.,LOKAL AA 4x 19.2.;Melani Mekicar,Matino Antunovi?,Gaja Fila?;2 1/4
1;01-24A;Hr/Pred Sodiš?em;DAN-EXT;VIDEOKLIC LARE Nini - Lara po sodni obravnavi;2 Lara,18V Nina Videoklic,291 Policaj  EXT. 1x;Policaj  EXT. 1x;Gaja Fila?,Melani Mekicar;2 1/4
1;Jan-25;Lj/Julijino Stanovanje/Dnevna Soba;DAN-INT.;JULIJA PIŠE MARKU SMS  KO JO ZMOTI HIŠNI ZVONEC.;10 Julija;;Sabina Kogovšek; 3/8
1;Jan-26;Lj/Julijino Stanovanje/Predsoba;DAN-INT.;BB PRESENETI JULIJO S ŠOPKOM. ŽELI SE POBOTATI Z NJO.;10 Julija,19 Bb;;Sabina Kogovšek,Valter Dragan; 3/8
1;Jan-27;Hr/Pred Sodiš?em;DAN-EXT.;" JANA ODPUSTI MARKU  LARO PA PRIZADANE POGLED NA JANO  KI OBJEMA MARKA. JO ZABOLI MAMINA ""IZDAJA"". ";2 Lara,1 Mark,21 Mia,12 Jana,194 ?rt,291 Policaj  EXT. 1x;Policaj  EXT. 1x;Gaja Fila?,Matej Zemlji?,Zala Djuri?,Tanja Poto?nik,Aljaž Tepina;1 3/4
2;02-Jan;Hr/Pred Sodiš?em;DAN-EXT.; MARK JE HVALEŽEN JANI  KER MU JE ODPUSTILA. LARA PA PRIZADETA ODIDE  NE DA BI SE POKAZALA JANI. ;2 Lara,1 Mark,21 Mia,12 Jana,194 ?rt,291 Policaj  EXT. 1x;Policaj  EXT. 1x;Gaja Fila?,Matej Zemlji?,Zala Djuri?,Tanja Poto?nik,Aljaž Tepina; 3/4
2;02-Feb;Lj/Pasaža/Lokal;DAN-INT.; DINO JE NAVDUŠEN  KER TUDI NINA DELA V PASAŽI. SAŠKA PA JEZNA  KO GA UJAME PRI SPOGLEDOVANJU Z NINO. ;18 Nina,4 Dino,5 Saška,1001 Dojen?ek,227 LOKAL A 3x 19.2.,228 LOKAL AA 4x 19.2.;LOKAL A 3x 19.2.,LOKAL AA 4x 19.2.;Melani Mekicar,Matino Antunovi?,Mila Peršin,Dane Pevc;3 3/8
2;02-Mar;Hr/Pred Sodiš?em;DAN-EXT.; Mark pokima.;1 Mark,21 Mia,3 Edvard,291 Policaj  EXT. 1x;Policaj  EXT. 1x;Matej Zemlji?,Zala Djuri?,Aleš Vali?;1 7/8
2;02-Apr;Lj/Julijino Stanovanje/Dnevna Soba;DAN-INT.; JULIJA NE ŽELI VE? DELATI BB-JU USLUG  ?E NE BO IZPOLNIL SVOJIH OBLJUB. ;10 Julija,19 Bb;;Sabina Kogovšek,Valter Dragan;2
2;02-May;Lj/Pe?nikova Pisarna;DAN-INT.; PE?NIKA ZASKRBI  DA JE PREHITRO NA LASTNO PEST AKTIVIRAL OPERATIVCA. BI VENDARLE PO?AKAL NA ŠEFOV BLAGOSLOV.  ;15 Pe?nik,39 Tajnica;;Matija Rupel,Vesna Ponorac;1 5/8
2;02-Jun;Lj/Kova?eva Mesnica;DAN-INT.; SAŠKA DINU O?ITA FLIRTANJE Z NINO. DINO POBESNI  KER JE SIT DELA V MESNICI IN HO?E TAKOJ NAZAJ NA MORJE.;4 Dino,5 Saška,1001 Dojen?ek,217 pasaža standard (3) - B;pasaža standard (3) - B;Matino Antunovi?,Mila Peršin,Dane Pevc;1 7/8
2;02-Jul;Lj/Julijino Stanovanje/Dnevna Soba;DAN-INT.; BB MANIPULIRA Z JULIJIMI ?USTVI  DA BI SI ZAGOTOVIL NJENO POMO?. ;10 Julija,19 Bb;;Sabina Kogovšek,Valter Dragan;2 3/8
2;02-Aug;Kemp/Pred recepcijo;DAN-EXT.; MARKA OB PRIHODU V KEMP PREPLAVIJO NEPRIJETNI SPOMINI. MIO PA ZASKRBI  DA MARK ŠE NI PREBOLEL LARE.;1 Mark,21 Mia,203 KEMP VE? (15);KEMP VE? (15);Matej Zemlji?,Zala Djuri?;1 3/4
2;02-Sep;Lj/Pe?nikova Pisarna;DAN-INT.; PE?NIK JE RAZDRAŽEN ZARADI ŠTEVILNIH ODPOVEDI. GA MIKA  DA BI VENDARLE POSLAL OPERATIVCA NAD MINISTRA.  ;15 Pe?nik;;Matija Rupel;1 1/2
2;02-Oct;Lj/Julijino Stanovanje/Dnevna Soba;DAN-INT.;BB IN JULIJA STA IZ?RPANA PO STRASTNEM SEKSU  KO BB DOBI PE?NIKOV KLIC. BB GA IGNORIRA.;10 Julija,19 Bb;;Sabina Kogovšek,Valter Dragan;1 1/2
2;02-Nov;Kemp/Pred recepcijo;DAN-EXT.; MIA JE ZARADI MARKOVEGA MOLKA PREPRI?ANA  DA VENDARLE ŠE NI PREBOLEL LARE. EDVARD JU ZMOTI  PREDEN LAHKO RAZ?ISTITA.;1 Mark,21 Mia,3 Edvard,203 KEMP VE? (15);KEMP VE? (15);Matej Zemlji?,Zala Djuri?,Aleš Vali?; 7/8
2;02-Dec;Lj/Kozmeti?ni Salon/Sprejemnica;DAN-INT.; SAŠKA SE PO PREPIRU Z DINOM ZATE?E PO TOLAŽBO K MERI. ;5 Saška,6 Meri,200 pasaža standard (3),205 Stranka,1000 Vozi?ek;pasaža standard (3),Stranka;Mila Peršin,Vesna Pernar?i?;2 1/8
2;Feb-13;Kemp/Bar Na Plaži;DAN-EXT;V BARU NA PLAŽI HRVOJE PRIPRAVLJA ZAKUSKO  DA PROSLAVIJO MARKOVO OPROSTITEV.;1 Mark,21 Mia,14 Hrvoje,3 Edvard,7 Frenk,206 KEMP STANDARD (7);KEMP STANDARD (7);Matej Zemlji?,Zala Djuri?,Alen Šalinovi?,Aleš Vali?,Gaber Trseglav;1 7/8
2;Feb-14;Kemp/Janina Parcela/Pred Avtodomom;DAN-EXT.; ?RT JE DOBRE VOLJE ZARADI NOVICE O NAKUPU VASICE. JANO PA ZASKRBI  KJE BOSTA DOBILA DENAR ZA ARO. ;12 Jana,194 ?rt,206 KEMP STANDARD (7);KEMP STANDARD (7);Tanja Poto?nik,Aljaž Tepina;2 1/2
2;Feb-15;Lj/Kozmeti?ni Salon/Sprejemnica;DAN-INT.;Saška je v offu povedala Meri  da v Borutovem lokalu dela - Nina. Meri presene?eno gleda Saško.;5 Saška,6 Meri,200 pasaža standard (3),1000 Vozi?ek;pasaža standard (3);Mila Peršin,Vesna Pernar?i?;2 3/8
2;Feb-16;Kemp/Bar Na Plaži;DAN-EXT.;HRVOJE SANJARI O DVOJNI POROKI V KEMPU. MARK IN MIA PA STA VSAK V SVOJIH SKRBEH. MIA MISLI  DA MARK NI PREBOLEL LARE.;1 Mark,21 Mia,14 Hrvoje,3 Edvard,7 Frenk,206 KEMP STANDARD (7);KEMP STANDARD (7);Matej Zemlji?,Zala Djuri?,Alen Šalinovi?,Aleš Vali?,Gaber Trseglav;2 3/8
2;Feb-17;Lj/Kova?eva Mesnica;DAN-INT.; SAŠKA SE OPRAVI?I DINU ZA LJUBOSUMNI IZBRUH IN GA POVABI NA KONCERT.  ;4 Dino,5 Saška,1000 Vozi?ek,217 pasaža standard (3) - B;pasaža standard (3) - B;Matino Antunovi?,Mila Peršin;2 1/4
2;Feb-18;Kemp/Janina Parcela/Pred Avtodomom;DAN-EXT.; MARK SE USTAVI PRI ?RTU. JE HVALEŽEN JANI  KER MU JE ODPUSTILA. BI SE JI RAD NEKAKO ODDOLŽIL. ?RT VE  KAKO. ;1 Mark,194 ?rt,206 KEMP STANDARD (7);KEMP STANDARD (7);Matej Zemlji?,Aljaž Tepina;1 3/8
2;Feb-19;Lj/Pasaža;DAN-INT.;SAŠKA IN DINO GRESTA ZVE?ER NA KONCERT. SAŠKA UPA  DA BOSTA POKRPALA SVOJ ODNOS. MERI BO POSKRBELA ZA VARSTVO.;18 Nina,5 Saška,6 Meri,306 Stranka kozmeti?nega salona 1,1000 Vozi?ek,228 LOKAL AA 4x 19.2.;LOKAL AA 4x 19.2.;Melani Mekicar,Mila Peršin,Vesna Pernar?i?,Tanja Mojzer;1 1/8
2;Feb-20;Kemp/Nad Plažo Pri Pomolu;DAN-EXT.;PE?NIKOV OPERATIVEC IZ ZASEDE OPAZUJE STANETA V ?OLNU.;161 Stane,250 Operativec,206 KEMP STANDARD (7);KEMP STANDARD (7);Bojan Maroševi?,Damjan M. Trbovc; 3/8
2;Feb-21;Lj/Pe?nikova Pisarna;DAN-INT.;PE?NIK OKLEVA  ALI NAJ BREZ BB-JEVEGA DOVOLJENJA DA ZELENO LU? OPERATIVCU?;15 Pe?nik;;Matija Rupel; 3/4
2;Feb-22;Kemp/Janina Parcela/Pred Avtodomom;DAN-EXT.; ?RT POVE MARKU  DA IMATA Z JANO FINAN?NI PROBLEM. MARK BI RAD POMAGAL JANI. ;1 Mark,194 ?rt,206 KEMP STANDARD (7);KEMP STANDARD (7);Matej Zemlji?,Aljaž Tepina;2 3/4
2;Feb-23;Lj/Julijino Stanovanje/Dnevna Soba;DAN-INT.; BB POVE JULIJI  DA IMA TEŽAVO. ZA USPEŠNO IZPELJAVO KONGRESA POTREBUJE JULIJINO POMO?. BO JULIJA UGODILA BB-JU?;10 Julija,19 Bb;;Sabina Kogovšek,Valter Dragan;1 1/2
2;Feb-24;Kemp/Janina Parcela/Pred Avtodomom;DAN-EXT.;MARK PONUDI JANI ODŠKODNINO. JANA JE ŠOKIRANA.;1 Mark,12 Jana,194 ?rt,206 KEMP STANDARD (7);KEMP STANDARD (7);Matej Zemlji?,Tanja Poto?nik,Aljaž Tepina;1
2;Feb-25;Lj/Dolen?evo Stanovanje/Predsoba;DAN-INT.; LARO DOMA PRI?AKA NEPRIJETNO PRESENE?ENJE.;2 Lara,252 Erika;;Gaja Fila?,Bernarda Oman; 5/8
3;03-Jan;Kemp/Janina Parcela/Pred Avtodomom;DAN-EXT.;JANA ZAVRNE MARKOVO PONUDBO Z ODŠKODNINO. ?RT JE OSUPEL.;1 Mark,12 Jana,194 ?rt,206 KEMP STANDARD (7);KEMP STANDARD (7);Matej Zemlji?,Tanja Poto?nik,Aljaž Tepina;1 3/8
3;03-Feb;Lj/Dolen?evo Stanovanje/Predsoba;DAN-INT.;LARA IZVE  DA JE JANA ODDALA NJUNO STANOVANJE. NOVA PODNAJEMNIKA STA STANE JAMNIK IN NJEGOVA ŽENA.;2 Lara,252 Erika;;Gaja Fila?,Bernarda Oman;1 3/4
3;03-Mar;Kemp/Pomol;DAN-EXT.;OPERATIVEC SE PRIPRAVLJA NA AKCIJO. STANE NE SLUTI  KAKŠNA NEVARNOST MU GROZI.;161 Stane,250 Operativec;;Bojan Maroševi?,Damjan M. Trbovc;1 5/8
3;03-Apr;Lj/Bb-Jeva Pisarna;DAN-INT.;BB SE VRNE V PISARNO. PE?NIK GA PRI?AKA NA TRNIH. GA ZANIMA  ALI JE BB-JU USPELO UREDITI TEŽAVO Z MINISTRSTVOM?;19 Bb,15 Pe?nik;;Valter Dragan,Matija Rupel; 3/4
3;03-May;Kemp/Janina Parcela/Pred Avtodomom;DAN-EXT.;JANA POVE ?RTU  DA V RESNICI NIMA DENARJA ZA ARO  A GA NE MISLI VZETI OD MARKA. ?RT JEZEN ODIDE SLIKAT.;12 Jana,194 ?rt,206 KEMP STANDARD (7);KEMP STANDARD (7);Tanja Poto?nik,Aljaž Tepina;1 3/4
3;03-Jun;Kemp/Pri Milenini Klopci;DAN-EXT.;MARK POVE EDIJU  DA JE PONUDIL JANI ODŠKODNINO. IN DA JE PRED SODIŠ?EM SRE?AL LARO. MARKA PREGANJAJO NJENE BESEDE.;1 Mark,3 Edvard,207 NI STATISTOV;NI STATISTOV;Matej Zemlji?,Aleš Vali?;1 7/8
3;03-Jul;Kemp/Pomol;DAN-EXT.;OPERATIVEC SE S STANETOM ODPRAVLJA NA MORJE  KO DOBI PE?NIKOVO SPORO?ILO. AKCIJA JE PREKLICANA.;161 Stane,250 Operativec,206 KEMP STANDARD (7);KEMP STANDARD (7);Bojan Maroševi?,Damjan M. Trbovc;1
3;03-Aug;Lj/Bb-Jeva Pisarna;DAN-INT.;PE?NIK BI PROSLAVIL DOBRO NOVICO S ŠEFOM. BB GA POSTAVI NA NJEGOVO MESTO. NI ŠE ?AS ZA PROSLAVLJANJE.;19 Bb,15 Pe?nik;;Valter Dragan,Matija Rupel;1 7/8
3;03-Sep;Lj/Pasaža/Lokal;DAN-INT.;NINO NJEN NOVI FANT POVABI NA SALSO. ŽANOVE NA?RTE PREKRIŽA LARIN PRIHOD. LARA POTREBUJE NININO TOLAŽBO.;2 Lara,18 Nina,253 Žan,227 LOKAL A 3x 19.2.,228 LOKAL AA 4x 19.2.;LOKAL A 3x 19.2.,LOKAL AA 4x 19.2.;Gaja Fila?,Melani Mekicar,Domen Novak;2 1/8
3;03-Oct;Kemp/Pri Milenini Klopci;DAN-EXT.;EDVARDA SKRBI ZA MARKA  KI GA JE SRE?ANJE Z LARO VRGLO IZ TIRA. MARK GA POMIRI. MARK JE SRE?EN Z MIO  NE BO JE SPUSTIL IZ ROK.;1 Mark,3 Edvard,207 NI STATISTOV;NI STATISTOV;Matej Zemlji?,Aleš Vali?;2 3/4
3;03-Nov;Kemp/Pot ?ez Kemp;DAN-EXT.;MARK SE VRNE DO MIE. POMIRI NJENE DVOME IN JI ZAGOTOVI  DA JE LARA PRETEKLOST.;1 Mark,21 Mia,206 KEMP STANDARD (7);KEMP STANDARD (7);Matej Zemlji?,Zala Djuri?;1 1/2
3;03-Dec;Lj/Pasaža/Lokal;DAN-INT.;LARA POVE NINI O SRE?ANJU Z MARKOM IN O TEM  DA JE JANA ODDALA NJUNO STANOVANJE. NINA JE ŠOKIRANA.;2 Lara,18 Nina,253 Žan,227 LOKAL A 3x 19.2.,228 LOKAL AA 4x 19.2.;LOKAL A 3x 19.2.,LOKAL AA 4x 19.2.;Gaja Fila?,Melani Mekicar,Domen Novak;2 1/2
3;Mar-13;Lj/Julijino Stanovanje/Jedilnica;DAN-INT.;JULIJA PREDLAGA ROMANU SODELOVANJE NA KONGRESU. ROMAN JE ZADRŽAN  A JULIJA IMA MAMLJIV PREDLOG.;10 Julija,251 Roman;;Sabina Kogovšek,Uroš Smolej;2 1/4
3;Mar-14;Kemp/Klubska soba;DAN-INT.;MARK IN MIA IGRATA PIKADO. MIA JE ZMAGOVALKA - V VSEH POGLEDIH.;1 Mark,21 Mia,207 NI STATISTOV;NI STATISTOV;Matej Zemlji?,Zala Djuri?;1 7/8
3;Mar-15;Lj/Pasaža/Lokal;DAN-INT.;LARA SE PO?UTI IZDANO  KER JE JANA ODPUSTILA MARKU. NININ FANT PA RAZJEZI LARO  KO ZAGOVARJA JANO. LARA JEZNA ODIDE.;2 Lara,18 Nina,253 Žan,227 LOKAL A 3x 19.2.,228 LOKAL AA 4x 19.2.;LOKAL A 3x 19.2.,LOKAL AA 4x 19.2.;Gaja Fila?,Melani Mekicar,Domen Novak;3 1/8
3;Mar-16;Lj/Julijino Stanovanje/Jedilnica;DAN-INT.;JULIJA IZKORISTI ROMANOVO NAVDUŠENJE IN SI IZPOSLUJE MESTO V UPRAVI TER PROSI ROMANA  DA UREDI PROBLEM Z MINISTROM.;10 Julija,251 Roman;;Sabina Kogovšek,Uroš Smolej;2 1/2
3;Mar-17;Lj/Klub;DAN-INT.;LARA JE PRIŠLA UTOPIT RAZO?ARANJA TEGA DNE ZA ŠANK. A UGOTOVI  DA JE IZGUBILA DENARNICO.;2 Lara,254 Barman,208 KLUB STATISTI (?);KLUB STATISTI (?);Gaja Fila?;1 7/8
3;Mar-18;Kemp/Plaža Pod Barom;DAN-EXT.;"?RT ZNAŠA SVOJO JEZO NAD ""PLATNOM"". JANA JE ŠOKIRANA ZARADI ?RTOVEGA ""DIVJANJA"".";12 Jana,194 ?rt,206 KEMP STANDARD (7);KEMP STANDARD (7);Tanja Poto?nik,Aljaž Tepina; 5/8
3;Mar-19;Lj/Pasaža/Lokal;DAN-INT.;LARA SE VRNE V PASAŽO PO IZGUBLJENO DENARNICO. VIDI  DA JE LOKAL ZAPRT. DINO PA JE PRESENE?EN OB POGLEDU NA LARO.;2 Lara,4 Dino,227 LOKAL A 3x 19.2.,228 LOKAL AA 4x 19.2.;LOKAL A 3x 19.2.,LOKAL AA 4x 19.2.;Gaja Fila?,Matino Antunovi?; 5/8
3;Mar-20;Kemp/Klubska soba;DAN-INT.;MARK DOKON?NO POMIRI MIINE DVOME ZARADI LARE. MARK LJUBI MIO.;1 Mark,21 Mia,207 NI STATISTOV;NI STATISTOV;Matej Zemlji?,Zala Djuri?;1 3/4
3;Mar-21;Kemp/Plaža Pod Barom;DAN-EXT.;?RT PRITISKA NA JANO  NAJ SPREJME OD MARKA ODŠKODNINO. JANA NE POPUSTI. ?RT SPET UŽALJEN ODIDE.;12 Jana,194 ?rt,206 KEMP STANDARD (7);KEMP STANDARD (7);Tanja Poto?nik,Aljaž Tepina;1 1/4
3;Mar-22;Lj/Pasaža;NO?-INT;SAŠKA JE PRIŠLA PO DINA V MESNICO  DA GRESTA SKUPAJ NA KONCERT. DINA NI.;5 Saška;;Mila Peršin; 5/8
3;Mar-23;Lj/Klub;NO?-INT.;DINO JE POSPREMIL LARO V KLUB  DA PORAVNA SVOJ DOLG. LARA SE RESNO LOTI PITJA. DINO JO POSKUŠA USTAVITI  A MU NE USPEVA.;2 Lara,4 Dino,254 Barman,208 KLUB STATISTI (?);KLUB STATISTI (?);Gaja Fila?,Matino Antunovi?;2 7/8
3;Mar-24;Lj/Bistro Lotus/Separe;NO?-INT.;JULIJA POVE BB-JU DOBRO NOVICO. NJEN ŠEF BO UREDIL ZAPLET Z MINISTRSTVOM. A JULIJA ŽELI NEKAJ V ZAMENO.;10 Julija,19 Bb,411 Natakarica,300 STATISTI LOTUS A 6x 10.4.;STATISTI LOTUS A 6x 10.4.;Sabina Kogovšek,Valter Dragan,Ksenija Žuni?;1
3;Mar-25;Lj/Pasaža;NO?-INT.;SAŠKA JE STRTA  SAJ ZAMAN ?AKA NA DINA.;5 Saška;;Mila Peršin; 1/4
3;Mar-26;Lj/Klub;NO?-INT.;DINO JE ZARADI POPITEGA ALKOHOLA IN LARE POZABIL NA SAŠKO. GA VLE?E V LARIN OBJEM.;2 Lara,4 Dino,254 Barman,255 Vid,208 KLUB STATISTI (?);KLUB STATISTI (?);Gaja Fila?,Matino Antunovi?,Gašper Lovrec; 5/8
4;04-Jan;Lj/Bistro Lotus/Separe;NO?-INT.; JULIJA POSTAVI BB-JA PRED DEJSTVO - BREZ NJE NE MORE SPELJATI KONGRESA. BO BB SPREJEL NJEN POGOJ?;10 Julija,19 Bb,411 Natakarica,300 STATISTI LOTUS A 6x 10.4.;STATISTI LOTUS A 6x 10.4.;Sabina Kogovšek,Valter Dragan,Ksenija Žuni?;1 7/8
4;04-Feb;Lj/Klub;NO?-INT;DINOV IN LARIN POLJUB PREPRE?I SAŠKIN KLIC. LARA POŠLJE DINA DOMOV  OSTANE ZA ŠANKOM Z VIDOM.;2 Lara,4 Dino,254 Barman,255 Vid,208 KLUB STATISTI (?);KLUB STATISTI (?);Gaja Fila?,Matino Antunovi?,Gašper Lovrec;2 1/2
4;04-Mar;Lj/Bistro Lotus/Separe;NO?-INT.; JULIJA DA BB-JU ULTIMAT  SAJ ON DRUGE IZBIRE ITAK NIMA.;10 Julija,19 Bb,411 Natakarica,300 STATISTI LOTUS A 6x 10.4.;STATISTI LOTUS A 6x 10.4.;Sabina Kogovšek,Valter Dragan,Ksenija Žuni?;1 3/4
4;04-Apr;Lj/Klub;NO?-INT;LARA DOBI PRENO?IŠ?E ZA TO NO?.;2 Lara,254 Barman,255 Vid,208 KLUB STATISTI (?);KLUB STATISTI (?);Gaja Fila?,Gašper Lovrec;1 3/8
4;04-May;Kemp/Naravna plaža;DAN-EXT.; JUTRANJE PRAZNA PLAŽA. LE DVE BRISA?I OB ROBU MORJA.;;;; 1/4
4;04-Jun;Kemp/Naravna Plaža/V Vodi;DAN-EXT.;MARK IN MIA ROMANTI?NO ZA?ENJATA DAN IN NOVO POGLAVJE.;1 Mark,21 Mia;;Matej Zemlji?,Zala Djuri?; 5/8
4;04-Jul;Lj/Pasaža/Lokal;DAN-INT.; NINA DOBI LARINO DENARNICO. A SKRBI JO  KJE IN KAKO JE LARA PREBILA NO??;18 Nina,253 Žan,256 Lastnik Starinarnice,229 LOKAL B 1x 19.2.,230 LOKAL BB 3x 19.2.;LOKAL B 1x 19.2.,LOKAL BB 3x 19.2.;Melani Mekicar,Domen Novak,Jože Drabik Jug;2
4;04-Aug;Kemp/Edvardova parcela/Pred prikolico;DAN-EXT.; EDVARD IN STANE ZASNUJETA SKUPEN MOŠKI PROJEKT.;3 Edvard,161 Stane,206 KEMP STANDARD (7);KEMP STANDARD (7);Aleš Vali?,Bojan Maroševi?;3 3/8
4;04-Sep;Lj/Julijino Stanovanje/Predsoba;DAN-INT.;PARALELNI SEKVENCI (TELEFONSKI POGOVOR) BB SPREJME JULIJIN POGOJ ZA EKSKLUZIVO NJENEGA PODJETJA NA KONGRESU.;10 Julija,19PS BB PS;;Sabina Kogovšek,Valter Dragan;1 3/8
4;04-Oct;Lj/Bb-Jeva Pisarna;DAN-INT.;PARALELNI SEKVENCI (TELEFONSKI POGOVOR) BB SPREJME JULIJIN POGOJ ZA EKSKLUZIVO NJENEGA PODJETJA NA KONGRESU.;19 Bb,10PS Julija PS;;Valter Dragan,Sabina Kogovšek;1 3/8
4;04-Nov;Kemp/Naravna plaža;DAN-EXT.;MARKU IN MII SLUŽBEN KLIC POKVARI ROMANTI?NO IDILO.;1 Mark,21 Mia,206 KEMP STANDARD (7);KEMP STANDARD (7);Matej Zemlji?,Zala Djuri?;2
4;04-Dec;Kemp/Edvardova parcela/Pred prikolico;DAN-EXT.; STANE ODHAJA. EDVARD NA?RTUJE PROJEKT NADGRADNJE STANETOVE PRIKOLICE IN PARCELE.;3 Edvard,161 Stane,206 KEMP STANDARD (7);KEMP STANDARD (7);Aleš Vali?,Bojan Maroševi?;1 5/8
4;Apr-13;Lj/Bb-Jeva Pisarna;DAN-INT.; BB JE ZELO RAZKURJEN  KER JE MORAL SPREJETI JULIJIN POGOJ.;19 Bb,15 Pe?nik;;Valter Dragan,Matija Rupel;1 1/8
4;Apr-14;Kemp/Edvardova parcela/Pred prikolico;DAN-EXT.; MARKU SE MUDI DELAT NA KLINIKO V LJUBLJANO  MIA BI PA ŠE OSTALA NA MORJU.;1 Mark,21 Mia,3 Edvard,206 KEMP STANDARD (7);KEMP STANDARD (7);Matej Zemlji?,Zala Djuri?,Aleš Vali?;1 7/8
4;Apr-15;Lj/Pasaža/Lokal;DAN-INT.;ZMA?KANI LARI NI DO POGOVORA  NINA PA IMA LARINEGA IZMIKANJA DOVOLJ.;2 Lara,18 Nina,229 LOKAL B 1x 19.2.,230 LOKAL BB 3x 19.2.;LOKAL B 1x 19.2.,LOKAL BB 3x 19.2.;Gaja Fila?,Melani Mekicar;1 3/4
4;Apr-16;Lj/Kozmeti?ni Salon/Sprejemnica;DAN-INT.; SAŠKA SUMI  DA JE BIL DINO PREJŠNJI VE?ER Z NINO. MERI BO ZAHTEVALA  DA BORUT ODPUSTI NINO. SAŠKA BO TO UREDILA SAMA.;5 Saška,6 Meri,200 pasaža standard (3),1000 Vozi?ek;pasaža standard (3);Mila Peršin,Vesna Pernar?i?;2 7/8
4;Apr-17;Kemp/Janina Parcela/Pred Avtodomom;DAN-EXT.; HRVOJE ZATEŽI JANI ZARADI ?RTA  KI MU JE NAREDIL SRANJE NA PLAŽI. JANA BO SAMA O?ISTILA PLAŽO.;14 Hrvoje,12 Jana,206 KEMP STANDARD (7);KEMP STANDARD (7);Alen Šalinovi?,Tanja Poto?nik;1 7/8
4;Apr-18;Lj/Pasaža/Lokal;DAN-INT.; LARA IN NINA SE POBOTATA. SAŠKO PA NJUNA DOBRA VOLJA VRŽE IZ TIRA IN NEKONTROLIRANO NADERE NINO.;2 Lara,18 Nina,5 Saška,1000 Vozi?ek,229 LOKAL B 1x 19.2.,230 LOKAL BB 3x 19.2.;LOKAL B 1x 19.2.,LOKAL BB 3x 19.2.;Gaja Fila?,Melani Mekicar,Mila Peršin;1 3/8
4;Apr-19;Kemp/Plaža Pod Barom;DAN-EXT.; JANA ?ISTI OSTANKE ?RTOVEGA DIVJEGA SLIKANJA NA PLAŽI. ?RT PRITISNE NA JANO ZA MARKOVO ODŠKODNINO.;12 Jana,194 ?rt,206 KEMP STANDARD (7);KEMP STANDARD (7);Tanja Poto?nik,Aljaž Tepina;1 3/4
4;Apr-20;Lj/Dolen?evo Stanovanje/Dnevna Soba;DAN-INT.; STANETA DOMA PRI?AKA SITNA ERIKA. STANE ODIDE POD TUŠ. ERIKA PA SE JAVI NA STANETOV TELEFON. ;161 Stane,252 Erika;;Bojan Maroševi?,Bernarda Oman;1
4;Apr-21;Lj/Pasaža/Lokal;DAN-INT.; SAŠKA IZLIJE VSO SVOJO JEZO NA NINO.;2 Lara,18 Nina,5 Saška,23 Borut,1000 Vozi?ek,229 LOKAL B 1x 19.2.,230 LOKAL BB 3x 19.2.;LOKAL B 1x 19.2.,LOKAL BB 3x 19.2.;Gaja Fila?,Melani Mekicar,Mila Peršin,Miha Rodman;1 1/4
4;Apr-22;Kemp/Plaža Pod Barom;DAN-EXT.; ?RT JE USPEŠNO ZBUDIL V JANI SLABO VEST. JANA OBLJUBI  DA BO REKLA MARKU ZA DENAR. ;12 Jana,194 ?rt,206 KEMP STANDARD (7);KEMP STANDARD (7);Tanja Poto?nik,Aljaž Tepina;2 7/8
4;Apr-23;Lj/Pasaža/Lokal;DAN-INT.; LARA NINI PRIZNA  DA JE BILA ONA Z DINOM. NATO PA ODIDE  SAJ SE NO?E NINI OPRAVI?EVATI ZA SVOJA DEJANJA.;2 Lara,18 Nina,5 Saška,23 Borut,1000 Vozi?ek,229 LOKAL B 1x 19.2.,230 LOKAL BB 3x 19.2.;LOKAL B 1x 19.2.,LOKAL BB 3x 19.2.;Gaja Fila?,Melani Mekicar,Mila Peršin,Miha Rodman;2 1/8
4;Apr-24;Lj/Dolen?evo Stanovanje/Dnevna Soba;DAN-INT.; STANE MORA NUJNO VRNIT KLIC PREMIERU.;161 Stane,252 Erika;;Bojan Maroševi?,Bernarda Oman;1
4;Apr-25;Lj/Kozmeti?ni Salon/Soba;DAN-INT.; SAŠKA JE VSA IZ SEBE. MERI PA SKLENE  DA BO STVARI VZELA V SVOJE ROKE.;5 Saška,6 Meri,1001 Dojen?ek;;Mila Peršin,Vesna Pernar?i?,Dane Pevc; 5/8
4;Apr-26;Kemp/Pred recepcijo;DAN-EXT.; BO JANA LE PROSILA MARKA ZA DENAR?;1 Mark,21 Mia,12 Jana,203 KEMP VE? (15);KEMP VE? (15);Matej Zemlji?,Zala Djuri?,Tanja Poto?nik; 7/8
4;Apr-27;Lj/Klub;DAN-INT;LARA SE VRNE V KLUB IN NADALJUJE ?ISTO ENAKO KOT PREJŠNJI VE?ER.;2 Lara,254 Barman,207 NI STATISTOV;NI STATISTOV;Gaja Fila?; 7/8
5;05-Jan;Kemp/Pred recepcijo;DAN-EXT.;JANA SE POTEGNE NAZAJ. NE MORE PROSIT MARKA ZA DENAR.;1 Mark,21 Mia,12 Jana,203 KEMP VE? (15);KEMP VE? (15);Matej Zemlji?,Zala Djuri?,Tanja Poto?nik;1
5;05-Feb;Lj/Dolen?evo Stanovanje/Kabinet;DAN-INT.; Stane utihne  posluša  zraven si jezno mane sence  poskuša se pomiriti.;161 Stane;;Bojan Maroševi?;1 3/8
5;05-Mar;Lj/Pasaža;DAN-INT.;MERI ZAHTEVA OD BORUTA  DA ODPUSTI NINO.;6 Meri,23 Borut,230 LOKAL BB 3x 19.2.;LOKAL BB 3x 19.2.;Vesna Pernar?i?,Miha Rodman;1 3/4
5;05-Apr;Kemp/Janina Parcela/Pred Avtodomom;DAN-EXT.;JANA NE MORE PRIZNATI ?RTU  DA NI REKLA MARKU ZA ODŠKODNINO. ZAGOTOVI ?RTU  DA BOSTA DOBILA DENAR.;12 Jana,194 ?rt,206 KEMP STANDARD (7);KEMP STANDARD (7);Tanja Poto?nik,Aljaž Tepina; 7/8
5;05-May;Lj/Dolen?evo Stanovanje/Dnevna Soba;DAN-INT.;ERIKO SKRBI ZA STANETOVO KARIERO  STANE PA SE VRA?A V KEMP. ERIKA JE JEZNA  MISLI  DA EDVARD SLABO VPLIVA NA STANETA.;161 Stane,252 Erika;;Bojan Maroševi?,Bernarda Oman;2 1/4
5;05-Jun;Lj/Pasaža;DAN-INT.;BORUT ZAVRNE MERIJINO ZAHTEVO  DA ODPUSTI NINO IN JO DODATNO RAZKURI Z OMEMBO NJENIH ZAKONSKIH TEŽAV.;6 Meri,23 Borut,230 LOKAL BB 3x 19.2.;LOKAL BB 3x 19.2.;Vesna Pernar?i?,Miha Rodman;2 1/8
5;05-Jul;Kemp/Janina Parcela/Pred Avtodomom;DAN-EXT.;?RT ODHAJA PODPISAT KUPOPRODAJNO POGODBO. JANA PA POKLI?E NA BANKO  DA BI VZELA KREDIT.;12 Jana,194 ?rt,307OFF Referentka Off,206 KEMP STANDARD (7);KEMP STANDARD (7);Tanja Poto?nik,Aljaž Tepina;1 1/2
5;05-Aug;Lj/Vila/Vhodna Veža s Stopniš?em;DAN-INT.;MARK IN MIA SE VRNETA DOMOV. MARK JE PRIZADET ZARADI JULIJINEGA HLADNEGA ODZIVA NA NJEGOVO OPROSTITEV.;1 Mark,21 Mia,10 Julija;;Matej Zemlji?,Zala Djuri?,Sabina Kogovšek;1 3/8
5;05-Sep;Lj/Klub;DAN-INT.;LARA RAZMIŠLJA  DA BI OPUSTILA SVOJ PIVSKI POHOD  A JO RAZDRAŽI NININ SMS. LARA SE PRIDRUŽI VESELI DRUŽBI PIVCEV.;2 Lara,254 Barman,308 Tip,208 KLUB STATISTI (?);KLUB STATISTI (?);Gaja Fila?;1 7/8
